test/test_convert_files/t4_cache_input.json
{
    "schema_version": "1.0.0",
    "device_name": "",
    "kernel_name": "convolution_kernel",
    "problem_size": [
        4096,
        4096
    ],
    "tune_params_keys": [
        "block_size_x",
        "block_size_y",
        "tile_size_x",
        "tile_size_y",
        "read_only",
        "use_padding",
        "use_shmem",
        "use_cmem",
        "filter_height",
        "filter_width"
    ],
    "tune_params": {
        "block_size_x": [
            16
        ],
        "block_size_y": [
            1
        ],
        "tile_size_x": [
            1
        ],
        "tile_size_y": [
            1
        ],
        "read_only": [
            0
        ],
        "use_padding": [
            0
        ],
        "use_shmem": [
            0
        ],
        "use_cmem": [
            1
        ],
        "filter_height": [
            15
        ],
        "filter_width": [
            15
        ]
    },
    "objective": "time",
    "cache": {
        "16,1,1,1,0,0,0,1,15,15": {
            "block_size_x": 16,
            "block_size_y": 1,
            "tile_size_x": 1,
            "tile_size_y": 1,
            "read_only": 0,
            "use_padding": 0,
            "use_shmem": 0,
            "use_cmem": 1,
            "filter_height": 15,
            "filter_width": 15,
            "time": 12.262957006692886,
            "times": [
                12.265098571777344,
                12.252779960632324,
                12.25790023803711,
                12.253418922424316,
                12.254219055175781,
                12.26366138458252,
                12.251818656921387,
                12.264618873596191,
                12.252618789672852,
                12.257740020751953,
                12.259658813476562,
                12.253725051879883,
                12.257899284362793,
                12.25325870513916,
                12.25629997253418,
                12.25309944152832,
                12.258379936218262,
                12.264481544494629,
                12.258378982543945,
                12.258858680725098,
                12.262378692626953,
                12.257099151611328,
                12.256779670715332,
                12.256739616394043,
                12.260458946228027,
                12.431501388549805,
                12.259498596191406,
                12.259979248046875,
                12.256778717041016,
                12.259296417236328,
                12.254538536071777,
                12.251660346984863
            ],
            "compile_time": 661.5392221137881,
            "verification_time": 0,
            "benchmark_time": 393.9172066748142,
            "GFLOP/s": 615.6547067627729,
            "strategy_time": 0,
            "framework_time": 53.12582431361079,
            "timestamp": "2023-12-21 10:44:42.236642+00:00"
        }
    }
}