test/test_cache_files/invalid_missing_cache_large.json
{
"device_name": "Testing",
"kernel_name": "convolution_kernel",
"problem_size": [
4096,
4096
],
"tune_params_keys": [
"block_size_x",
"block_size_y",
"tile_size_x",
"tile_size_y",
"read_only",
"use_padding",
"use_shmem",
"use_cmem",
"filter_height",
"filter_width"
],
"tune_params": {
"block_size_x": [
16,
32,
48,
64,
80,
96,
112,
128,
144,
160,
176,
192,
208,
224,
240,
256
],
"block_size_y": [
1,
2,
4,
8,
16
],
"tile_size_x": [
1,
2,
3,
4
],
"tile_size_y": [
1,
2,
3,
4
],
"read_only": [
0,
1
],
"use_padding": [
0,
1
],
"use_shmem": [
0,
1
],
"use_cmem": [
1
],
"filter_height": [
15
],
"filter_width": [
15
]
},
"objective": "time",
"cache": {
"16,1,1,1,0,0,0,1,15,15": {"block_size_x": 16, "block_size_y": 1, "tile_size_x": 1, "tile_size_y": 1, "read_only": 0, "use_padding": 0, "use_shmem": 0, "use_cmem": 1, "filter_height": 15, "filter_width": 15, "time": 12.262957006692886, "times": [12.265098571777344, 12.252779960632324, 12.25790023803711, 12.253418922424316, 12.254219055175781, 12.26366138458252, 12.251818656921387, 12.264618873596191, 12.252618789672852, 12.257740020751953, 12.259658813476562, 12.253725051879883, 12.257899284362793, 12.25325870513916, 12.25629997253418, 12.25309944152832, 12.258379936218262, 12.264481544494629, 12.258378982543945, 12.258858680725098, 12.262378692626953, 12.257099151611328, 12.256779670715332, 12.256739616394043, 12.260458946228027, 12.431501388549805, 12.259498596191406, 12.259979248046875, 12.256778717041016, 12.259296417236328, 12.254538536071777, 12.251660346984863], "compile_time": 661.5392221137881, "verification_time": 0, "benchmark_time": 393.9172066748142, "GFLOP/s": 615.6547067627729, "strategy_time": 0, "framework_time": 53.12582431361079, "timestamp": "2023-12-21 10:44:42.236642+00:00"},
"16,1,1,1,0,0,1,1,15,15": {"block_size_x": 16, "block_size_y": 1, "tile_size_x": 1, "tile_size_y": 1, "read_only": 0, "use_padding": 0, "use_shmem": 1, "use_cmem": 1, "filter_height": 15, "filter_width": 15, "time": 12.34145200252533, "times": [12.3654203414917, 12.343340873718262, 12.343339920043945, 12.333259582519531, 12.340140342712402, 12.33586597442627, 12.343819618225098, 12.345100402832031, 12.347339630126953, 12.335659980773926, 12.335020065307617, 12.340396881103516, 12.344301223754883, 12.343339920043945, 12.338540077209473, 12.341899871826172, 12.336939811706543, 12.336755752563477, 12.351180076599121, 12.339981079101562, 12.349579811096191, 12.340940475463867, 12.33950138092041, 12.340375900268555, 12.334859848022461, 12.340780258178711, 12.34990119934082, 12.33981990814209, 12.345900535583496, 12.332321166992188, 12.339020729064941, 12.33182144165039], "compile_time": 326.4552033506334, "verification_time": 0, "benchmark_time": 396.81255631148815, "GFLOP/s": 611.7389751590945, "strategy_time": 0, "framework_time": 2.972428221255541, "timestamp": "2023-12-21 10:44:42.962940+00:00"},
"16,1,1,1,0,1,1,1,15,15": {"block_size_x": 16, "block_size_y": 1, "tile_size_x": 1, "tile_size_y": 1, "read_only": 0, "use_padding": 1, "use_shmem": 1, "use_cmem": 1, "filter_height": 15, "filter_width": 15, "time": 12.346593052148819, "times": [12.3654203414917, 12.346540451049805, 12.358381271362305, 12.346381187438965, 12.34398078918457, 12.343509674072266, 12.345260620117188, 12.344301223754883, 12.342540740966797, 12.344301223754883, 12.342540740966797, 12.343490600585938, 12.339659690856934, 12.34286117553711, 12.347981452941895, 12.344941139221191, 12.341421127319336, 12.346572875976562, 12.344940185546875, 12.34749984741211, 12.346059799194336, 12.355500221252441, 12.350700378417969, 12.345030784606934, 12.342860221862793, 12.341580390930176, 12.34253978729248, 12.3468599319458, 12.3489408493042, 12.349058151245117, 12.34589958190918, 12.353421211242676], "compile_time": 326.4245339669287, "verification_time": 0, "benchmark_time": 396.92616602405906, "GFLOP/s": 611.4842506035324, "strategy_time": 0, "framework_time": 0.9948583319783211, "timestamp": "2023-12-21 10:44:43.687302+00:00"},
"16,1,1,1,1,0,0,1,15,15": {"block_size_x": 16, "block_size_y": 1, "tile_size_x": 1, "tile_size_y": 1, "read_only": 1, "use_padding": 0, "use_shmem": 0, "use_cmem": 1, "filter_height": 15, "filter_width": 15, "time": 6.64582659304142, "times": [6.8259968757629395, 6.642314910888672, 6.634634971618652, 6.642955780029297, 6.641036033630371, 6.633676052093506, 6.641036033630371, 6.649355888366699, 6.6363959312438965, 6.640420913696289, 6.63639497756958, 6.641194820404053, 6.6383161544799805, 6.644714832305908, 6.638315200805664, 6.640554904937744, 6.638155937194824, 6.639434814453125, 6.643276214599609, 6.637413024902344, 6.637355804443359, 6.642475128173828, 6.6424760818481445, 6.634955883026123, 6.6405558586120605, 6.63783597946167, 6.640875816345215, 6.638794898986816, 6.641836166381836, 6.640024185180664, 6.6399149894714355, 6.643755912780762], "compile_time": 345.7579957321286, "verification_time": 0, "benchmark_time": 213.88119040057063, "GFLOP/s": 1136.013270027996, "strategy_time": 0, "framework_time": 0.7923957891762257, "timestamp": "2023-12-21 10:44:44.247748+00:00"},
"16,1,1,1,1,0,1,1,15,15": {"block_size_x": 16, "block_size_y": 1, "tile_size_x": 1, "tile_size_y": 1, "read_only": 1, "use_padding": 0, "use_shmem": 1, "use_cmem": 1, "filter_height": 15, "filter_width": 15, "time": 12.3233422935009, "times": [12.34749984741211, 12.323980331420898, 12.322699546813965, 12.320619583129883, 12.322220802307129, 12.318915367126465, 12.322219848632812, 12.318699836730957, 12.325579643249512, 12.32318115234375, 12.316940307617188, 12.316546440124512, 12.320940017700195, 12.318059921264648, 12.31566047668457, 12.316780090332031, 12.320940017700195, 12.32703685760498, 12.320779800415039, 12.32013988494873, 12.338220596313477, 12.320460319519043, 12.32158088684082, 12.3276948928833, 12.32334041595459, 12.32446002960205, 12.3185396194458, 12.327659606933594, 12.31742000579834, 12.334737777709961, 12.322859764099121, 12.33053970336914], "compile_time": 323.3141880482435, "verification_time": 0, "benchmark_time": 395.8132811821997, "GFLOP/s": 612.6379532589625, "strategy_time": 0, "framework_time": 1.3811048120260239, "timestamp": "2023-12-21 10:44:44.968272+00:00"},
"16,1,1,1,1,1,1,1,15,15": {"block_size_x": 16, "block_size_y": 1, "tile_size_x": 1, "tile_size_y": 1, "read_only": 1, "use_padding": 1, "use_shmem": 1, "use_cmem": 1, "filter_height": 15, "filter_width": 15, "time": 12.332039475440979, "times": [12.349419593811035, 12.330221176147461, 12.320619583129883, 12.327659606933594, 12.319499969482422, 12.324612617492676, 12.32446002960205, 12.32509994506836, 12.328620910644531, 12.504623413085938, 12.326700210571289, 12.323296546936035, 12.325260162353516, 12.322699546813965, 12.331979751586914, 12.327980041503906, 12.324620246887207, 12.327615737915039, 12.32942008972168, 12.329899787902832, 12.32334041595459, 12.326539993286133, 12.323019981384277, 12.325926780700684, 12.32349967956543, 12.327980995178223, 12.329099655151367, 12.326539993286133, 12.324139595031738, 12.324187278747559, 12.312620162963867, 12.334059715270996], "compile_time": 323.7900398671627, "verification_time": 0, "benchmark_time": 396.21788496151567, "GFLOP/s": 612.2058897909933, "strategy_time": 0, "framework_time": 1.1702780611813068, "timestamp": "2023-12-21 10:44:45.689466+00:00"},
"16,1,1,2,0,0,0,1,15,15": {"block_size_x": 16, "block_size_y": 1, "tile_size_x": 1, "tile_size_y": 2, "read_only": 0, "use_padding": 0, "use_shmem": 0, "use_cmem": 1, "filter_height": 15, "filter_width": 15, "time": 3.6253343299031258, "times": [3.6472411155700684, 3.6226019859313965, 3.6462810039520264, 3.619720935821533, 3.6190810203552246, 3.617002010345459, 3.617640972137451, 3.6400411128997803, 3.6206820011138916, 3.6202011108398438, 3.616520881652832, 3.6374809741973877, 3.644521951675415, 3.625641107559204, 3.6202011108398438, 3.640681028366089, 3.6208410263061523, 3.62253999710083, 3.6187610626220703, 3.619400978088379, 3.619882106781006, 3.622441053390503, 3.619720935821533, 3.6416409015655518, 3.6258020401000977, 3.620521068572998, 3.6190810203552246, 3.619720935821533, 3.6189210414886475, 3.6211609840393066, 3.621320962905884, 3.6234021186828613], "compile_time": 413.3805222809315, "verification_time": 0, "benchmark_time": 117.44891619309783, "GFLOP/s": 2082.496816287214, "strategy_time": 0, "framework_time": 1.3593826442956924, "timestamp": "2023-12-21 10:44:46.221670+00:00"},
"16,1,1,2,0,0,1,1,15,15": {"block_size_x": 16, "block_size_y": 1, "tile_size_x": 1, "tile_size_y": 2, "read_only": 0, "use_padding": 0, "use_shmem": 1, "use_cmem": 1, "filter_height": 15, "filter_width": 15, "time": 6.656750321388245, "times": [6.679755210876465, 6.649835109710693, 6.64823579788208, 6.658155918121338, 6.649995803833008, 6.647435188293457, 6.646796226501465, 6.64983606338501, 6.650794982910156, 6.648237228393555, 6.653515815734863, 6.647755146026611, 6.656235218048096, 6.651275157928467, 6.64599609375, 6.645835876464844, 6.64679479598999, 6.646315097808838, 6.816718101501465, 6.652376174926758, 6.652875900268555, 6.65415620803833, 6.647914886474609, 6.653835773468018, 6.648076057434082, 6.650795936584473, 6.653835773468018, 6.65415620803833, 6.648715972900391, 6.655760765075684, 6.651916027069092, 6.65207576751709], "compile_time": 371.418665163219, "verification_time": 0, "benchmark_time": 214.51672166585922, "GFLOP/s": 1134.1490720693762, "strategy_time": 0, "framework_time": 1.3851621188223362, "timestamp": "2023-12-21 10:44:46.809008+00:00"},
"16,1,1,2,0,1,1,1,15,15": {"block_size_x": 16, "block_size_y": 1, "tile_size_x": 1, "tile_size_y": 2, "read_only": 0, "use_padding": 1, "use_shmem": 1, "use_cmem": 1, "filter_height": 15, "filter_width": 15, "time": 6.655352085828781, "times": [6.680075168609619, 6.654315948486328, 6.653515815734863, 6.656556129455566, 6.651275157928467, 6.652875900268555, 6.649355888366699, 6.658155918121338, 6.655275821685791, 6.650475025177002, 6.655914783477783, 6.666316032409668, 6.651115894317627, 6.656075954437256, 6.65415620803833, 6.650634765625, 6.6560750007629395, 6.655435085296631, 6.6536760330200195, 6.653504848480225, 6.657354831695557, 6.653995990753174, 6.655436038970947, 6.657835960388184, 6.651275157928467, 6.657674789428711, 6.64983606338501, 6.654476165771484, 6.652394771575928, 6.655333995819092, 6.65207576751709, 6.6587958335876465], "compile_time": 373.34413500502706, "verification_time": 0, "benchmark_time": 214.38566781580448, "GFLOP/s": 1134.3873476018873, "strategy_time": 0, "framework_time": 1.2402520515024662, "timestamp": "2023-12-21 10:44:47.397994+00:00"},
"16,1,1,2,1,0,0,1,15,15": {"block_size_x": 16, "block_size_y": 1, "tile_size_x": 1, "tile_size_y": 2, "read_only": 1, "use_padding": 0, "use_shmem": 0, "use_cmem": 1, "filter_height": 15, "filter_width": 15, "time": 3.625722549855709, "times": [3.6474010944366455, 3.6240410804748535, 3.6178019046783447, 3.6168410778045654, 3.617480993270874, 3.6173219680786133, 3.6170010566711426, 3.6192409992218018, 3.6166810989379883, 3.619081974029541, 3.6238820552825928, 3.6229209899902344, 3.6221210956573486, 3.6181209087371826, 3.6187610626220703, 3.6195619106292725, 3.618601083755493, 3.6189610958099365, 3.6189210414886475, 3.6192409992218018, 3.6190810203552246, 3.618921995162964, 3.6250009536743164, 3.619400978088379, 3.624680995941162, 3.621320962905884, 3.620521068572998, 3.772202968597412, 3.6221210956573486, 3.6184420585632324, 3.6218008995056152, 3.625641107559204], "compile_time": 395.64133808016777, "verification_time": 0, "benchmark_time": 117.44928732514381, "GFLOP/s": 2082.273835404326, "strategy_time": 0, "framework_time": 1.4298586174845695, "timestamp": "2023-12-21 10:44:47.912528+00:00"},
"16,1,1,2,1,0,1,1,15,15": {"block_size_x": 16, "block_size_y": 1, "tile_size_x": 1, "tile_size_y": 2, "read_only": 1, "use_padding": 0, "use_shmem": 1, "use_cmem": 1, "filter_height": 15, "filter_width": 15, "time": 6.63874888420105, "times": [6.66311502456665, 6.645036220550537, 6.650475978851318, 6.643595218658447, 6.6383161544799805, 6.635436058044434, 6.641995906829834, 6.641995906829834, 6.635756015777588, 6.634507179260254, 6.634955883026123, 6.63399600982666, 6.638474941253662, 6.636714935302734, 6.635916233062744, 6.635274887084961, 6.633835792541504, 6.6338348388671875, 6.637515068054199, 6.640456199645996, 6.6383161544799805, 6.638794898986816, 6.637034893035889, 6.633995056152344, 6.634634971618652, 6.640395164489746, 6.634154796600342, 6.641994953155518, 6.634954929351807, 6.642012119293213, 6.634955883026123, 6.637516021728516], "compile_time": 367.4304997548461, "verification_time": 0, "benchmark_time": 213.8350009918213, "GFLOP/s": 1137.2243975016063, "strategy_time": 0, "framework_time": 1.2861210852861404, "timestamp": "2023-12-21 10:44:48.495093+00:00"},
"16,1,1,2,1,1,1,1,15,15": {"block_size_x": 16, "block_size_y": 1, "tile_size_x": 1, "tile_size_y": 2, "read_only": 1, "use_padding": 1, "use_shmem": 1, "use_cmem": 1, "filter_height": 15, "filter_width": 15, "time": 6.642681434750557, "times": [6.676074981689453, 6.640716075897217, 6.639756202697754, 6.639595985412598, 6.638956069946289, 6.635756015777588, 6.6359148025512695, 6.638794898986816, 6.642795085906982, 6.641703128814697, 6.63783597946167, 6.639276027679443, 6.642155170440674, 6.6405558586120605, 6.6424760818481445, 6.6407151222229, 6.649195194244385, 6.643115997314453, 6.64215612411499, 6.6388258934021, 6.64839506149292, 6.645356178283691, 6.640076160430908, 6.642315864562988, 6.639595985412598, 6.643596172332764, 6.645835876464844, 6.643916130065918, 6.640235900878906, 6.644041061401367, 6.646635055541992, 6.639435768127441], "compile_time": 367.58366599678993, "verification_time": 0, "benchmark_time": 213.90030719339848, "GFLOP/s": 1136.5511464247277, "strategy_time": 0, "framework_time": 1.4101010747253895, "timestamp": "2023-12-21 10:44:49.078002+00:00"},
"16,1,1,3,0,0,0,1,15,15": {"block_size_x": 16, "block_size_y": 1, "tile_size_x": 1, "tile_size_y": 3, "read_only": 0, "use_padding": 0, "use_shmem": 0, "use_cmem": 1, "filter_height": 15, "filter_width": 15, "time": 91.15654587745667, "times": [91.41393280029297, 91.19730377197266, 91.22066497802734, 91.18396759033203, 91.27621459960938, 91.09488677978516, 91.13092803955078, 91.12933349609375, 91.13983154296875, 91.13188171386719, 91.15139770507812, 91.20086669921875, 91.17503356933594, 91.21188354492188, 91.14115142822266, 91.00557708740234, 91.02537536621094, 91.0839614868164, 91.08213806152344, 91.17733001708984, 91.08831787109375, 91.16560363769531, 91.19052124023438, 91.13909149169922, 91.17447662353516, 91.17793273925781, 91.14430236816406, 91.16617584228516, 91.1328125, 91.0850830078125, 91.1725845336914, 91.19890594482422], "compile_time": 3295.9692240692675, "verification_time": 0, "benchmark_time": 2918.696199078113, "GFLOP/s": 82.82177793517161, "strategy_time": 0, "framework_time": 1.3277227990329266, "timestamp": "2023-12-21 10:44:55.294011+00:00"},
"16,1,1,3,0,0,1,1,15,15": {"block_size_x": 16, "block_size_y": 1, "tile_size_x": 1, "tile_size_y": 3, "read_only": 0, "use_padding": 0, "use_shmem": 1, "use_cmem": 1, "filter_height": 15, "filter_width": 15, "time": 23.1905876994133, "times": [23.38042640686035, 23.205385208129883, 23.183202743530273, 23.21994400024414, 23.139144897460938, 23.172067642211914, 23.121383666992188, 23.318187713623047, 23.290315628051758, 23.216903686523438, 23.09386444091797, 23.158172607421875, 23.088584899902344, 23.071624755859375, 23.249204635620117, 23.202823638916016, 23.18138313293457, 23.258132934570312, 23.155303955078125, 23.127944946289062, 23.221004486083984, 23.182024002075195, 23.187623977661133, 23.08723258972168, 23.24954605102539, 23.230186462402344, 23.168437957763672, 23.172903060913086, 23.19754409790039, 23.21977424621582, 23.155624389648438, 23.192903518676758], "compile_time": 422.3542641848326, "verification_time": 0, "benchmark_time": 743.4682017192245, "GFLOP/s": 325.55221531496596, "strategy_time": 0, "framework_time": 1.420781947672367, "timestamp": "2023-12-21 10:44:56.461270+00:00"},
"16,1,1,3,0,1,1,1,15,15": {"block_size_x": 16, "block_size_y": 1, "tile_size_x": 1, "tile_size_y": 3, "read_only": 0, "use_padding": 1, "use_shmem": 1, "use_cmem": 1, "filter_height": 15, "filter_width": 15, "time": 23.38534814119339, "times": [23.43802833557129, 23.390188217163086, 23.357210159301758, 23.406347274780273, 23.363948822021484, 23.407129287719727, 23.393388748168945, 23.399627685546875, 23.40253257751465, 23.374507904052734, 23.386028289794922, 23.38364028930664, 23.34282875061035, 23.61018943786621, 23.37596321105957, 23.366668701171875, 23.38410758972168, 23.355939865112305, 23.405868530273438, 23.347627639770508, 23.375764846801758, 23.350187301635742, 23.337068557739258, 23.36451530456543, 23.380748748779297, 23.343788146972656, 23.388032913208008, 23.394668579101562, 23.37514877319336, 23.3909912109375, 23.35850715637207, 23.379947662353516], "compile_time": 422.78860695660114, "verification_time": 0, "benchmark_time": 749.9241572804749, "GFLOP/s": 322.84091536362837, "strategy_time": 0, "framework_time": 1.4146501198410988, "timestamp": "2023-12-21 10:44:57.635413+00:00"},
"16,1,1,3,1,0,0,1,15,15": {"block_size_x": 16, "block_size_y": 1, "tile_size_x": 1, "tile_size_y": 3, "read_only": 1, "use_padding": 0, "use_shmem": 0, "use_cmem": 1, "filter_height": 15, "filter_width": 15, "time": 93.17676281929016, "times": [93.17304229736328, 93.13432312011719, 93.18128204345703, 93.25238037109375, 93.30612182617188, 93.29073333740234, 93.14704132080078, 93.11666107177734, 93.20463562011719, 93.27674865722656, 93.18463134765625, 93.25316619873047, 93.16700744628906, 93.09900665283203, 93.2696533203125, 93.17557525634766, 93.1313705444336, 93.24652862548828, 93.15238952636719, 93.099609375, 93.10369873046875, 93.11792755126953, 93.22509002685547, 93.08296203613281, 93.23306274414062, 93.1308364868164, 93.11367797851562, 93.16358947753906, 93.24441528320312, 93.14924621582031, 93.09878540039062, 93.13121032714844], "compile_time": 4188.3358135819435, "verification_time": 0, "benchmark_time": 2983.1490530632436, "GFLOP/s": 81.02607314918428, "strategy_time": 0, "framework_time": 1.3629812747240067, "timestamp": "2023-12-21 10:45:04.808276+00:00"},
"16,1,1,3,1,0,1,1,15,15": {"block_size_x": 16, "block_size_y": 1, "tile_size_x": 1, "tile_size_y": 3, "read_only": 1, "use_padding": 0, "use_shmem": 1, "use_cmem": 1, "filter_height": 15, "filter_width": 15, "time": 22.93182098865509, "times": [23.22602653503418, 22.782339096069336, 22.971847534179688, 22.86890411376953, 22.989543914794922, 22.899303436279297, 22.965543746948242, 22.84682273864746, 23.04808235168457, 23.072423934936523, 22.993064880371094, 23.017860412597656, 22.930503845214844, 22.969383239746094, 22.968795776367188, 22.771299362182617, 22.550979614257812, 23.023096084594727, 22.75402069091797, 22.82490348815918, 22.728946685791016, 22.959623336791992, 22.825542449951172, 23.76099967956543, 22.735780715942383, 22.825061798095703, 22.91053581237793, 22.858821868896484, 22.959623336791992, 22.81934356689453, 22.995624542236328, 22.963623046875], "compile_time": 419.55884313210845, "verification_time": 0, "benchmark_time": 735.4665361344814, "GFLOP/s": 329.22580390519516, "strategy_time": 0, "framework_time": 1.4878013171255589, "timestamp": "2023-12-21 10:45:05.964807+00:00"},
"16,1,1,3,1,1,1,1,15,15": {"block_size_x": 16, "block_size_y": 1, "tile_size_x": 1, "tile_size_y": 3, "read_only": 1, "use_padding": 1, "use_shmem": 1, "use_cmem": 1, "filter_height": 15, "filter_width": 15, "time": 23.337513327598572, "times": [23.382667541503906, 23.348907470703125, 23.329776763916016, 23.346187591552734, 23.319307327270508, 23.329591751098633, 23.353708267211914, 23.352428436279297, 23.336578369140625, 23.374187469482422, 23.362348556518555, 23.32677459716797, 23.35498809814453, 23.341388702392578, 23.32448387145996, 23.345867156982422, 23.34202766418457, 23.33415985107422, 23.294828414916992, 23.341707229614258, 23.298627853393555, 23.31642723083496, 23.308107376098633, 23.337547302246094, 23.330028533935547, 23.298828125, 23.362319946289062, 23.33610725402832, 23.346988677978516, 23.304912567138672, 23.358028411865234, 23.36058807373047], "compile_time": 418.27664989978075, "verification_time": 0, "benchmark_time": 748.3660727739334, "GFLOP/s": 323.5026411777895, "strategy_time": 0, "framework_time": 1.4829826541244984, "timestamp": "2023-12-21 10:45:07.132948+00:00"},
"16,1,1,4,0,0,0,1,15,15": {"block_size_x": 16, "block_size_y": 1, "tile_size_x": 1, "tile_size_y": 4, "read_only": 0, "use_padding": 0, "use_shmem": 0, "use_cmem": 1, "filter_height": 15, "filter_width": 15, "time": 2.3227564319968224, "times": [2.3552260398864746, 2.3251469135284424, 2.3201870918273926, 2.326746940612793, 2.3310670852661133, 2.3221070766448975, 2.317786931991577, 2.319706916809082, 2.3225860595703125, 2.321787118911743, 2.3219470977783203, 2.3197059631347656, 2.321945905685425, 2.3203461170196533, 2.320986032485962, 2.317945957183838, 2.322906017303467, 2.3232269287109375, 2.3189070224761963, 2.3179469108581543, 2.317466974258423, 2.319546937942505, 2.3163468837738037, 2.319706916809082, 2.322587013244629, 2.327867031097412, 2.3222579956054688, 2.318747043609619, 2.3233869075775146, 2.318587064743042, 2.332026958465576, 2.3214659690856934], "compile_time": 527.8685293160379, "verification_time": 0, "benchmark_time": 75.56926505640149, "GFLOP/s": 3250.3395948018747, "strategy_time": 0, "framework_time": 1.4809775166213512, "timestamp": "2023-12-21 10:45:07.737883+00:00"},
"16,1,1,4,0,0,1,1,15,15": {"block_size_x": 16, "block_size_y": 1, "tile_size_x": 1, "tile_size_y": 4, "read_only": 0, "use_padding": 0, "use_shmem": 1, "use_cmem": 1, "filter_height": 15, "filter_width": 15, "time": 3.7896979227662086, "times": [4.0106048583984375, 3.7926828861236572, 3.7870841026306152, 3.7789230346679688, 3.7786030769348145, 3.7798829078674316, 3.7858030796051025, 3.7779629230499268, 3.7774829864501953, 3.7795629501342773, 3.784363031387329, 3.777003049850464, 3.780042886734009, 3.7850029468536377, 3.7829229831695557, 3.784044027328491, 3.7838690280914307, 3.7859630584716797, 3.7816429138183594, 3.7806830406188965, 3.7794039249420166, 3.781162977218628, 3.7870841026306152, 3.7832438945770264, 3.78324294090271, 3.786763906478882, 3.7811639308929443, 3.7819631099700928, 3.782923936843872, 3.785964012145996, 3.781162977218628, 3.7821240425109863], "compile_time": 454.8558471724391, "verification_time": 0, "benchmark_time": 122.47234024107456, "GFLOP/s": 1992.176514820797, "strategy_time": 0, "framework_time": 1.3253865763545036, "timestamp": "2023-12-21 10:45:08.316553+00:00"},
"16,1,1,4,0,1,1,1,15,15": {"block_size_x": 16, "block_size_y": 1, "tile_size_x": 1, "tile_size_y": 4, "read_only": 0, "use_padding": 1, "use_shmem": 1, "use_cmem": 1, "filter_height": 15, "filter_width": 15, "time": 3.8466677367687225, "times": [3.8757240772247314, 3.8467650413513184, 3.8525240421295166, 3.8445239067077637, 3.846445083618164, 3.8472440242767334, 3.843724012374878, 3.8390839099884033, 3.8470840454101562, 3.846924066543579, 3.848043918609619, 3.842284917831421, 3.8483641147613525, 3.844844102859497, 3.8504440784454346, 3.845963954925537, 3.8476779460906982, 3.844844102859497, 3.8424439430236816, 3.8512439727783203, 3.841644048690796, 3.842603921890259, 3.841804027557373, 3.8451640605926514, 3.843883991241455, 3.8429250717163086, 3.8403639793395996, 3.848844051361084, 3.843883991241455, 3.8501250743865967, 3.8483641147613525, 3.8475639820098877], "compile_time": 456.09104027971625, "verification_time": 0, "benchmark_time": 124.17517928406596, "GFLOP/s": 1962.672036327717, "strategy_time": 0, "framework_time": 1.4535635709762573, "timestamp": "2023-12-21 10:45:08.898288+00:00"},
"16,1,1,4,1,0,0,1,15,15": {"block_size_x": 16, "block_size_y": 1, "tile_size_x": 1, "tile_size_y": 4, "read_only": 1, "use_padding": 0, "use_shmem": 0, "use_cmem": 1, "filter_height": 15, "filter_width": 15, "time": 2.3313023447990417, "times": [2.355705976486206, 2.328986883163452, 2.3230669498443604, 2.324666976928711, 2.3245060443878174, 2.3267459869384766, 2.322906970977783, 2.3237059116363525, 2.3243460655212402, 2.321626901626587, 2.519068956375122, 2.3273870944976807, 2.3225860595703125, 2.3264269828796387, 2.3272271156311035, 2.325627088546753, 2.320827007293701, 2.3243470191955566, 2.3225860595703125, 2.3251469135284424, 2.3259470462799072, 2.3219470977783203, 2.322746992111206, 2.3142659664154053, 2.3267459869384766, 2.3230669498443604, 2.3230860233306885, 2.3213069438934326, 2.324186086654663, 2.3281869888305664, 2.3241870403289795, 2.3285069465637207], "compile_time": 480.0516339018941, "verification_time": 0, "benchmark_time": 76.23218884691596, "GFLOP/s": 3238.4247443678473, "strategy_time": 0, "framework_time": 1.2866612523794174, "timestamp": "2023-12-21 10:45:09.455874+00:00"},
"16,1,1,4,1,0,1,1,15,15": {"block_size_x": 16, "block_size_y": 1, "tile_size_x": 1, "tile_size_y": 4, "read_only": 1, "use_padding": 0, "use_shmem": 1, "use_cmem": 1, "filter_height": 15, "filter_width": 15, "time": 3.7741837427020073, "times": [3.8050029277801514, 3.777163028717041, 3.7714040279388428, 3.7738029956817627, 3.7787630558013916, 3.7701239585876465, 3.769002914428711, 3.777323007583618, 3.7683639526367188, 3.7693240642547607, 3.773163080215454, 3.773803949356079, 3.7714040279388428, 3.7715630531311035, 3.777323007583618, 3.7704429626464844, 3.76997709274292, 3.7706029415130615, 3.776524066925049, 3.7746028900146484, 3.7741239070892334, 3.771883964538574, 3.7754030227661133, 3.7725229263305664, 3.7725229263305664, 3.77012300491333, 3.7714030742645264, 3.7725229263305664, 3.774282932281494, 3.773163080215454, 3.781964063644409, 3.774282932281494], "compile_time": 448.8627868704498, "verification_time": 0, "benchmark_time": 122.15729895979166, "GFLOP/s": 2000.3655663555471, "strategy_time": 0, "framework_time": 1.4242101460695267, "timestamp": "2023-12-21 10:45:10.028335+00:00"},
"16,1,1,4,1,1,1,1,15,15": {"block_size_x": 16, "block_size_y": 1, "tile_size_x": 1, "tile_size_y": 4, "read_only": 1, "use_padding": 1, "use_shmem": 1, "use_cmem": 1, "filter_height": 15, "filter_width": 15, "time": 3.809337370097637, "times": [3.8326830863952637, 3.8179640769958496, 3.803083896636963, 3.801323890686035, 3.8029229640960693, 3.8024439811706543, 3.8059639930725098, 3.8018031120300293, 3.8014841079711914, 3.7994039058685303, 3.800363063812256, 3.8035640716552734, 3.8013229370117188, 3.8021240234375, 3.8022830486297607, 3.801323890686035, 3.8025619983673096, 3.8035640716552734, 3.8022830486297607, 3.8026039600372314, 3.973484992980957, 3.8050038814544678, 3.8048439025878906, 3.8083629608154297, 3.8024439811706543, 3.8048439025878906, 3.801003932952881, 3.802284002304077, 3.802443027496338, 3.8019630908966064, 3.8006839752197266, 3.800363063812256], "compile_time": 449.43161914125085, "verification_time": 0, "benchmark_time": 123.79821809008718, "GFLOP/s": 1981.905635154203, "strategy_time": 0, "framework_time": 1.4880327507853508, "timestamp": "2023-12-21 10:45:10.603068+00:00"},
"16,1,2,1,0,0,0,1,15,15": {"block_size_x": 16, "block_size_y": 1, "tile_size_x": 2, "tile_size_y": 1, "read_only": 0, "use_padding": 0, "use_shmem": 0, "use_cmem": 1, "filter_height": 15, "filter_width": 15, "time": 11.78267040848732, "times": [11.789734840393066, 11.770054817199707, 11.774054527282715, 11.785575866699219, 11.780455589294434, 11.777687072753906, 11.784934997558594, 11.786215782165527, 11.78381633758545, 11.787015914916992, 11.782535552978516, 11.779899597167969, 11.779014587402344, 11.788294792175293, 11.785896301269531, 11.788616180419922, 11.779974937438965, 11.784403800964355, 11.783975601196289, 11.77885627746582, 11.777735710144043, 11.77885627746582, 11.793416023254395, 11.783649444580078, 11.784614562988281, 11.784775733947754, 11.781736373901367, 11.785735130310059, 11.78381633758545, 11.775032997131348, 11.783815383911133, 11.781255722045898], "compile_time": 972.4751622416079, "verification_time": 0, "benchmark_time": 378.2742409966886, "GFLOP/s": 640.7500963925587, "strategy_time": 0, "framework_time": 1.2645605020225048, "timestamp": "2023-12-21 10:45:11.955098+00:00"},
"16,1,2,1,0,0,1,1,15,15": {"block_size_x": 16, "block_size_y": 1, "tile_size_x": 2, "tile_size_y": 1, "read_only": 0, "use_padding": 0, "use_shmem": 1, "use_cmem": 1, "filter_height": 15, "filter_width": 15, "time": 11.86026132106781, "times": [11.878055572509766, 11.856136322021484, 11.85373592376709, 11.854537010192871, 11.854056358337402, 11.855210304260254, 11.849897384643555, 11.854696273803711, 11.85789680480957, 11.855816841125488, 11.851656913757324, 11.85958480834961, 11.855016708374023, 11.851177215576172, 11.851016998291016, 11.850056648254395, 11.859335899353027, 11.856810569763184, 11.846857070922852, 11.853896141052246, 11.854537010192871, 11.858535766601562, 11.85341739654541, 11.852826118469238, 11.853416442871094, 11.852456092834473, 11.852617263793945, 11.856295585632324, 11.85037612915039, 11.856719970703125, 12.02333927154541, 11.858377456665039], "compile_time": 421.84273805469275, "verification_time": 0, "benchmark_time": 381.0129868797958, "GFLOP/s": 636.5582507519553, "strategy_time": 0, "framework_time": 1.3672779314219952, "timestamp": "2023-12-21 10:45:12.759336+00:00"},
"16,1,2,1,0,1,1,1,15,15": {"block_size_x": 16, "block_size_y": 1, "tile_size_x": 2, "tile_size_y": 1, "read_only": 0, "use_padding": 1, "use_shmem": 1, "use_cmem": 1, "filter_height": 15, "filter_width": 15, "time": 11.854690343141556, "times": [11.881095886230469, 11.854536056518555, 11.856136322021484, 11.855016708374023, 11.852136611938477, 11.85372257232666, 11.853256225585938, 11.861096382141113, 11.852457046508789, 11.854536056518555, 11.851335525512695, 11.85393238067627, 11.850696563720703, 11.852935791015625, 11.854216575622559, 11.854696273803711, 11.853096961975098, 11.851645469665527, 11.849257469177246, 11.853256225585938, 11.852936744689941, 11.849896430969238, 11.851977348327637, 11.855411529541016, 11.858375549316406, 11.848775863647461, 11.854215621948242, 11.85373592376709, 11.854697227478027, 11.858575820922852, 11.855497360229492, 11.85693645477295], "compile_time": 423.715575132519, "verification_time": 0, "benchmark_time": 380.9834588319063, "GFLOP/s": 636.8573941172449, "strategy_time": 0, "framework_time": 1.350486185401678, "timestamp": "2023-12-21 10:45:13.565400+00:00"},
"16,1,2,1,1,0,0,1,15,15": {"block_size_x": 16, "block_size_y": 1, "tile_size_x": 2, "tile_size_y": 1, "read_only": 1, "use_padding": 0, "use_shmem": 0, "use_cmem": 1, "filter_height": 15, "filter_width": 15, "time": 6.540795400738716, "times": [6.572714805603027, 6.537196159362793, 6.538475036621094, 6.535274982452393, 6.532875061035156, 6.541035175323486, 6.535915851593018, 6.537994861602783, 6.535594940185547, 6.539331912994385, 6.537515163421631, 6.542634963989258, 6.541035175323486, 6.539754867553711, 6.539595127105713, 6.541675090789795, 6.539595127105713, 6.541194915771484, 6.541194915771484, 6.537703037261963, 6.54615592956543, 6.541676044464111, 6.541675090789795, 6.539435863494873, 6.540555000305176, 6.540555000305176, 6.539115905761719, 6.541035175323486, 6.5402350425720215, 6.539996147155762, 6.54247522354126, 6.5442352294921875], "compile_time": 477.15699579566717, "verification_time": 0, "benchmark_time": 211.28627005964518, "GFLOP/s": 1154.2552147629222, "strategy_time": 0, "framework_time": 1.209133304655552, "timestamp": "2023-12-21 10:45:14.255067+00:00"},
"16,1,2,1,1,0,1,1,15,15": {"block_size_x": 16, "block_size_y": 1, "tile_size_x": 2, "tile_size_y": 1, "read_only": 1, "use_padding": 0, "use_shmem": 1, "use_cmem": 1, "filter_height": 15, "filter_width": 15, "time": 11.838640570640564, "times": [11.855976104736328, 11.837096214294434, 11.836775779724121, 11.830536842346191, 11.828935623168945, 11.828145980834961, 11.83741569519043, 12.0260591506958, 11.836617469787598, 11.838055610656738, 11.83901596069336, 11.830047607421875, 11.827495574951172, 11.829575538635254, 11.833577156066895, 11.832136154174805, 11.829095840454102, 11.834219932556152, 11.82973575592041, 11.826696395874023, 11.83133602142334, 11.830857276916504, 11.833255767822266, 11.828313827514648, 11.8324556350708, 11.827336311340332, 11.829895973205566, 11.8311767578125, 11.830857276916504, 11.831609725952148, 11.83133602142334, 11.830857276916504], "compile_time": 416.9838950037956, "verification_time": 0, "benchmark_time": 380.1692328415811, "GFLOP/s": 637.7207885441782, "strategy_time": 0, "framework_time": 1.3690423220396042, "timestamp": "2023-12-21 10:45:15.053604+00:00"},
"16,1,2,1,1,1,1,1,15,15": {"block_size_x": 16, "block_size_y": 1, "tile_size_x": 2, "tile_size_y": 1, "read_only": 1, "use_padding": 1, "use_shmem": 1, "use_cmem": 1, "filter_height": 15, "filter_width": 15, "time": 11.832034021615982, "times": [11.85805606842041, 11.830535888671875, 11.833576202392578, 11.828777313232422, 11.827496528625488, 11.828967094421387, 11.83293628692627, 11.830856323242188, 11.831016540527344, 11.82845687866211, 11.830376625061035, 11.831186294555664, 11.830696105957031, 11.830697059631348, 11.831496238708496, 11.829416275024414, 11.829895973205566, 11.828810691833496, 11.828455924987793, 11.827336311340332, 11.827337265014648, 11.831815719604492, 11.827816009521484, 11.833576202392578, 11.830535888671875, 11.831016540527344, 11.831815719604492, 11.835975646972656, 11.841256141662598, 11.834229469299316, 11.836615562438965, 11.83405590057373], "compile_time": 419.4878148846328, "verification_time": 0, "benchmark_time": 380.10577019304037, "GFLOP/s": 638.0768671056339, "strategy_time": 0, "framework_time": 1.379622146487236, "timestamp": "2023-12-21 10:45:15.854593+00:00"},
"16,1,2,2,0,0,0,1,15,15": {"block_size_x": 16, "block_size_y": 1, "tile_size_x": 2, "tile_size_y": 2, "read_only": 0, "use_padding": 0, "use_shmem": 0, "use_cmem": 1, "filter_height": 15, "filter_width": 15, "time": 4.1925869435071945, "times": [4.214767932891846, 4.18452787399292, 4.181969165802002, 4.180528163909912, 4.189807891845703, 4.18644905090332, 4.18452787399292, 4.18452787399292, 4.184688091278076, 4.184207916259766, 4.18228816986084, 4.182608127593994, 4.185967922210693, 4.186929225921631, 4.182981967926025, 4.182767868041992, 4.369170188903809, 4.201808929443359, 4.190769195556641, 4.190767765045166, 4.184207916259766, 4.185967922210693, 4.184368133544922, 4.1891679763793945, 4.1875691413879395, 4.188208103179932, 4.187889099121094, 4.177649021148682, 4.191567897796631, 4.18874979019165, 4.188528060913086, 4.1768479347229], "compile_time": 995.5906178802252, "verification_time": 0, "benchmark_time": 135.3556257672608, "GFLOP/s": 1800.737182491072, "strategy_time": 0, "framework_time": 1.451974269002676, "timestamp": "2023-12-21 10:45:16.987007+00:00"},
"16,1,2,2,0,0,1,1,15,15": {"block_size_x": 16, "block_size_y": 1, "tile_size_x": 2, "tile_size_y": 2, "read_only": 0, "use_padding": 0, "use_shmem": 1, "use_cmem": 1, "filter_height": 15, "filter_width": 15, "time": 6.399570733308792, "times": [6.436392784118652, 6.400874137878418, 6.400554180145264, 6.40135383605957, 6.399593830108643, 6.402153968811035, 6.397034168243408, 6.401194095611572, 6.399433135986328, 6.397296905517578, 6.398313999176025, 6.395914077758789, 6.394952774047852, 6.397193908691406, 6.395913124084473, 6.402313232421875, 6.393834114074707, 6.397833824157715, 6.396873950958252, 6.397027969360352, 6.399592876434326, 6.39863395690918, 6.399272918701172, 6.398313999176025, 6.399592876434326, 6.3973541259765625, 6.396714210510254, 6.396714210510254, 6.399913787841797, 6.3973212242126465, 6.400073051452637, 6.396714210510254], "compile_time": 565.660024061799, "verification_time": 0, "benchmark_time": 206.5479219891131, "GFLOP/s": 1179.7271277438522, "strategy_time": 0, "framework_time": 1.3665980659425259, "timestamp": "2023-12-21 10:45:17.760596+00:00"},
"16,1,2,2,0,1,1,1,15,15": {"block_size_x": 16, "block_size_y": 1, "tile_size_x": 2, "tile_size_y": 2, "read_only": 0, "use_padding": 1, "use_shmem": 1, "use_cmem": 1, "filter_height": 15, "filter_width": 15, "time": 6.405186951160431, "times": [6.433193206787109, 6.407273769378662, 6.40151309967041, 6.397833824157715, 6.398152828216553, 6.396073818206787, 6.395113945007324, 6.399913787841797, 6.394954204559326, 6.397512912750244, 6.400234222412109, 6.410953998565674, 6.395593166351318, 6.397193908691406, 6.395432949066162, 6.396234035491943, 6.402793884277344, 6.395273208618164, 6.3975138664245605, 6.397902011871338, 6.396393775939941, 6.401834011077881, 6.39719295501709, 6.3975138664245605, 6.400713920593262, 6.573835849761963, 6.401514053344727, 6.396714210510254, 6.396072864532471, 6.401709079742432, 6.396234035491943, 6.395593166351318], "compile_time": 565.6307879835367, "verification_time": 0, "benchmark_time": 206.80135395377874, "GFLOP/s": 1178.6927153831487, "strategy_time": 0, "framework_time": 1.4368831180036068, "timestamp": "2023-12-21 10:45:18.534480+00:00"},
"16,1,2,2,1,0,0,1,15,15": {"block_size_x": 16, "block_size_y": 1, "tile_size_x": 2, "tile_size_y": 2, "read_only": 1, "use_padding": 0, "use_shmem": 0, "use_cmem": 1, "filter_height": 15, "filter_width": 15, "time": 3.569371871650219, "times": [3.5987610816955566, 3.5675621032714844, 3.57892107963562, 3.5656421184539795, 3.571721076965332, 3.5723609924316406, 3.5722010135650635, 3.5642011165618896, 3.5650010108947754, 3.568202018737793, 3.5682010650634766, 3.564521074295044, 3.5632410049438477, 3.5650010108947754, 3.5651609897613525, 3.566761016845703, 3.567720890045166, 3.5675830841064453, 3.5672409534454346, 3.5733211040496826, 3.567720890045166, 3.5648410320281982, 3.571561098098755, 3.5674009323120117, 3.567081928253174, 3.573641061782837, 3.5701210498809814, 3.5683610439300537, 3.5746009349823, 3.566601037979126, 3.5666019916534424, 3.5680410861968994], "compile_time": 607.2850460186601, "verification_time": 0, "benchmark_time": 115.39663374423981, "GFLOP/s": 2115.14727842284, "strategy_time": 0, "framework_time": 1.2952890247106552, "timestamp": "2023-12-21 10:45:19.258472+00:00"},
"16,1,2,2,1,0,1,1,15,15": {"block_size_x": 16, "block_size_y": 1, "tile_size_x": 2, "tile_size_y": 2, "read_only": 1, "use_padding": 0, "use_shmem": 1, "use_cmem": 1, "filter_height": 15, "filter_width": 15, "time": 6.388249441981316, "times": [6.41735315322876, 6.388554096221924, 6.395594120025635, 6.384714126586914, 6.388393878936768, 6.3856730461120605, 6.3952741622924805, 6.386474132537842, 6.386953830718994, 6.389636039733887, 6.387434005737305, 6.385834217071533, 6.387592792510986, 6.389033794403076, 6.390153884887695, 6.383432865142822, 6.390313148498535, 6.387433052062988, 6.385034084320068, 6.387250900268555, 6.381194114685059, 6.381673812866211, 6.383273124694824, 6.393513202667236, 6.384873867034912, 6.387434005737305, 6.3906331062316895, 6.381834030151367, 6.389674186706543, 6.386877059936523, 6.3840742111206055, 6.386794090270996], "compile_time": 555.866985116154, "verification_time": 0, "benchmark_time": 205.74615895748138, "GFLOP/s": 1181.8178467462044, "strategy_time": 0, "framework_time": 1.3479399494826794, "timestamp": "2023-12-21 10:45:20.021447+00:00"},
"16,1,2,2,1,1,1,1,15,15": {"block_size_x": 16, "block_size_y": 1, "tile_size_x": 2, "tile_size_y": 2, "read_only": 1, "use_padding": 1, "use_shmem": 1, "use_cmem": 1, "filter_height": 15, "filter_width": 15, "time": 6.391178667545319, "times": [6.411592960357666, 6.3842339515686035, 6.58711576461792, 6.384552955627441, 6.393672943115234, 6.383274078369141, 6.386794090270996, 6.385354042053223, 6.382472991943359, 6.379292964935303, 6.380713939666748, 6.384072780609131, 6.381514072418213, 6.383433818817139, 6.3842339515686035, 6.381514072418213, 6.383594036102295, 6.379912853240967, 6.383752822875977, 6.379921913146973, 6.381673812866211, 6.3856730461120605, 6.383112907409668, 6.3821539878845215, 6.38279390335083, 6.385354042053223, 6.387113094329834, 6.385832786560059, 6.388073921203613, 6.383409023284912, 6.387753009796143, 6.383752822875977], "compile_time": 558.9388948865235, "verification_time": 0, "benchmark_time": 205.9198459610343, "GFLOP/s": 1181.276192189391, "strategy_time": 0, "framework_time": 1.3559362851083279, "timestamp": "2023-12-21 10:45:20.787679+00:00"},
"16,1,2,3,0,0,0,1,15,15": {"block_size_x": 16, "block_size_y": 1, "tile_size_x": 2, "tile_size_y": 3, "read_only": 0, "use_padding": 0, "use_shmem": 0, "use_cmem": 1, "filter_height": 15, "filter_width": 15, "time": 85.79105234146118, "times": [85.76734161376953, 85.88050842285156, 85.80484008789062, 85.78658294677734, 85.79613494873047, 85.74163055419922, 85.80030822753906, 85.83904266357422, 85.78404998779297, 85.80035400390625, 85.78643035888672, 85.73220825195312, 85.75702667236328, 85.76859283447266, 85.81224060058594, 85.79326629638672, 85.75676727294922, 85.70787048339844, 85.8935317993164, 85.80242919921875, 85.7370376586914, 85.80659484863281, 85.86688232421875, 85.73503875732422, 85.87739562988281, 85.86105346679688, 85.81874084472656, 85.73462677001953, 85.81014251708984, 85.77690124511719, 85.71578979492188, 85.76231384277344], "compile_time": 1682.2135192342103, "verification_time": 0, "benchmark_time": 2746.9814899377525, "GFLOP/s": 88.00156885768087, "strategy_time": 0, "framework_time": 1.2713335454463959, "timestamp": "2023-12-21 10:45:25.218160+00:00"},
"16,1,2,3,0,0,1,1,15,15": {"block_size_x": 16, "block_size_y": 1, "tile_size_x": 2, "tile_size_y": 3, "read_only": 0, "use_padding": 0, "use_shmem": 1, "use_cmem": 1, "filter_height": 15, "filter_width": 15, "time": 35.21394348144531, "times": [35.088565826416016, 35.255008697509766, 35.18008804321289, 35.201751708984375, 35.20760726928711, 35.205894470214844, 35.23352813720703, 35.25932312011719, 35.22568893432617, 35.20568084716797, 35.2669677734375, 35.4788818359375, 35.25608825683594, 35.01616668701172, 35.28104782104492, 35.223018646240234, 35.32680892944336, 35.18528747558594, 35.1908073425293, 35.20247268676758, 35.223289489746094, 35.12819290161133, 35.04552459716797, 35.31169509887695, 35.29800796508789, 35.33539962768555, 35.145687103271484, 35.12677764892578, 35.26824951171875, 35.167293548583984, 35.155128479003906, 35.15026092529297], "compile_time": 776.8486458808184, "verification_time": 0, "benchmark_time": 1128.562637604773, "GFLOP/s": 214.39652744311527, "strategy_time": 0, "framework_time": 1.6130045987665653, "timestamp": "2023-12-21 10:45:27.125200+00:00"},
"16,1,2,3,0,1,1,1,15,15": {"block_size_x": 16, "block_size_y": 1, "tile_size_x": 2, "tile_size_y": 3, "read_only": 0, "use_padding": 1, "use_shmem": 1, "use_cmem": 1, "filter_height": 15, "filter_width": 15, "time": 35.243252754211426, "times": [35.425689697265625, 35.248958587646484, 35.21944808959961, 35.30366897583008, 35.269046783447266, 35.15663528442383, 35.35144805908203, 35.138004302978516, 35.312889099121094, 35.251670837402344, 35.204246520996094, 35.078834533691406, 35.30936813354492, 35.232398986816406, 35.165367126464844, 35.19478225708008, 35.27880859375, 35.359130859375, 35.16520690917969, 35.1908073425293, 35.41000747680664, 35.2751350402832, 35.24408721923828, 35.21403121948242, 35.26744842529297, 35.28125762939453, 35.282169342041016, 35.16228103637695, 35.088722229003906, 35.2137451171875, 35.20216751098633, 35.286624908447266], "compile_time": 776.6702696681023, "verification_time": 0, "benchmark_time": 1129.4276230037212, "GFLOP/s": 214.21822930625595, "strategy_time": 0, "framework_time": 1.55743770301342, "timestamp": "2023-12-21 10:45:29.032871+00:00"},
"16,1,2,3,1,0,0,1,15,15": {"block_size_x": 16, "block_size_y": 1, "tile_size_x": 2, "tile_size_y": 3, "read_only": 1, "use_padding": 0, "use_shmem": 0, "use_cmem": 1, "filter_height": 15, "filter_width": 15, "time": 82.8276116847992, "times": [82.89037322998047, 82.84140014648438, 82.83293151855469, 82.85240173339844, 82.79234313964844, 82.84051513671875, 82.85005950927734, 82.82086181640625, 82.7953109741211, 82.73762512207031, 82.8677978515625, 82.75569152832031, 82.81598663330078, 82.76747131347656, 82.84950256347656, 82.86996459960938, 82.8657455444336, 82.84950256347656, 82.77571105957031, 82.8716049194336, 82.98302459716797, 82.83992767333984, 82.76799774169922, 82.83246612548828, 82.81851196289062, 82.79185485839844, 82.63047790527344, 82.88324737548828, 82.76366424560547, 82.83245086669922, 82.96868896484375, 82.82846069335938], "compile_time": 1818.9812498167157, "verification_time": 0, "benchmark_time": 2652.1127107553184, "GFLOP/s": 91.15012550078822, "strategy_time": 0, "framework_time": 1.51141919195652, "timestamp": "2023-12-21 10:45:33.505492+00:00"},
"16,1,2,3,1,0,1,1,15,15": {"block_size_x": 16, "block_size_y": 1, "tile_size_x": 2, "tile_size_y": 3, "read_only": 1, "use_padding": 0, "use_shmem": 1, "use_cmem": 1, "filter_height": 15, "filter_width": 15, "time": 35.27253234386444, "times": [35.41752624511719, 35.196163177490234, 35.28904724121094, 35.255577087402344, 35.25960922241211, 35.2326545715332, 35.284889221191406, 35.26234436035156, 35.049686431884766, 35.35795211791992, 35.143768310546875, 35.26472854614258, 35.16648864746094, 35.32205581665039, 35.135929107666016, 35.315555572509766, 35.37864685058594, 35.20530700683594, 35.272247314453125, 35.37441635131836, 35.15128707885742, 35.34872055053711, 35.35880661010742, 35.362308502197266, 35.18360900878906, 35.40892028808594, 35.286808013916016, 35.35618209838867, 35.22616958618164, 35.3072624206543, 35.23576736450195, 35.31060028076172], "compile_time": 776.477016042918, "verification_time": 0, "benchmark_time": 1130.3582559339702, "GFLOP/s": 214.0404076009943, "strategy_time": 0, "framework_time": 1.4628232456743717, "timestamp": "2023-12-21 10:45:35.413806+00:00"},
"16,1,2,3,1,1,1,1,15,15": {"block_size_x": 16, "block_size_y": 1, "tile_size_x": 2, "tile_size_y": 3, "read_only": 1, "use_padding": 1, "use_shmem": 1, "use_cmem": 1, "filter_height": 15, "filter_width": 15, "time": 35.24172234535217, "times": [35.403446197509766, 35.167076110839844, 35.2298469543457, 35.32351303100586, 35.289527893066406, 35.119293212890625, 35.27784729003906, 35.25857162475586, 35.20200729370117, 35.21830368041992, 35.23688888549805, 35.16423416137695, 35.41960906982422, 35.35996627807617, 35.162967681884766, 35.28557586669922, 35.179927825927734, 35.12015151977539, 35.12584686279297, 35.24068832397461, 35.227447509765625, 35.20941162109375, 35.088409423828125, 35.30795669555664, 35.24824905395508, 35.18889617919922, 35.3159294128418, 35.355167388916016, 35.18680953979492, 35.430824279785156, 35.15032958984375, 35.240394592285156], "compile_time": 777.7400831691921, "verification_time": 0, "benchmark_time": 1129.284786991775, "GFLOP/s": 214.22753195817322, "strategy_time": 0, "framework_time": 1.4483151026070118, "timestamp": "2023-12-21 10:45:37.322295+00:00"},
"16,1,2,4,0,0,0,1,15,15": {"block_size_x": 16, "block_size_y": 1, "tile_size_x": 2, "tile_size_y": 4, "read_only": 0, "use_padding": 0, "use_shmem": 0, "use_cmem": 1, "filter_height": 15, "filter_width": 15, "time": 7.437730506062508, "times": [7.455766201019287, 7.426486015319824, 7.427445888519287, 7.42616605758667, 7.429366111755371, 7.437526226043701, 7.438325881958008, 7.437046051025391, 7.433862209320068, 7.432246208190918, 7.433045864105225, 7.4359259605407715, 7.438325881958008, 7.4359259605407715, 7.47240686416626, 7.439606189727783, 7.435445785522461, 7.440961837768555, 7.434805870056152, 7.437685966491699, 7.434326171875, 7.436406135559082, 7.43816614151001, 7.4380059242248535, 7.434966087341309, 7.436726093292236, 7.444296836853027, 7.4442458152771, 7.4380059242248535, 7.4338459968566895, 7.440246105194092, 7.439765930175781], "compile_time": 1023.8616028800607, "verification_time": 0, "benchmark_time": 239.43855380639434, "GFLOP/s": 1015.0606013280781, "strategy_time": 0, "framework_time": 1.472382340580225, "timestamp": "2023-12-21 10:45:38.587082+00:00"},
"16,1,2,4,0,0,1,1,15,15": {"block_size_x": 16, "block_size_y": 1, "tile_size_x": 2, "tile_size_y": 4, "read_only": 0, "use_padding": 0, "use_shmem": 1, "use_cmem": 1, "filter_height": 15, "filter_width": 15, "time": 3.6794996857643127, "times": [3.712682008743286, 3.686763048171997, 3.6821229457855225, 3.6760430335998535, 3.680202007293701, 3.677643060684204, 3.6779630184173584, 3.680042028427124, 3.676522970199585, 3.677483081817627, 3.678762912750244, 3.6787619590759277, 3.6818020343780518, 3.679403066635132, 3.67732310295105, 3.677001953125, 3.6773900985717773, 3.67732310295105, 3.677643060684204, 3.6786019802093506, 3.6779630184173584, 3.679563045501709, 3.6774818897247314, 3.6784420013427734, 3.6771628856658936, 3.6771628856658936, 3.679081916809082, 3.677001953125, 3.678602933883667, 3.6758830547332764, 3.677161931991577, 3.677001953125], "compile_time": 888.5291409678757, "verification_time": 0, "benchmark_time": 119.5941842161119, "GFLOP/s": 2051.840697040786, "strategy_time": 0, "framework_time": 1.3755648396909237, "timestamp": "2023-12-21 10:45:39.596596+00:00"},
"16,1,2,4,0,1,1,1,15,15": {"block_size_x": 16, "block_size_y": 1, "tile_size_x": 2, "tile_size_y": 4, "read_only": 0, "use_padding": 1, "use_shmem": 1, "use_cmem": 1, "filter_height": 15, "filter_width": 15, "time": 3.6866346672177315, "times": [3.7283620834350586, 3.6850030422210693, 3.681001901626587, 3.6792430877685547, 3.693643093109131, 3.6779630184173584, 3.878765106201172, 3.6808431148529053, 3.680042028427124, 3.6790831089019775, 3.6760430335998535, 3.677643060684204, 3.6766819953918457, 3.675723075866699, 3.683722972869873, 3.679403066635132, 3.67706298828125, 3.678122043609619, 3.67732310295105, 3.6779630184173584, 3.680202007293701, 3.6782829761505127, 3.6758830547332764, 3.677802085876465, 3.676841974258423, 3.676522970199585, 3.6760430335998535, 3.677962064743042, 3.6792430877685547, 3.6760430335998535, 3.67732310295105, 3.6765220165252686], "compile_time": 889.7682121023536, "verification_time": 0, "benchmark_time": 119.79815037921071, "GFLOP/s": 2047.869637622033, "strategy_time": 0, "framework_time": 1.3861535117030144, "timestamp": "2023-12-21 10:45:40.607563+00:00"},
"16,1,2,4,1,0,0,1,15,15": {"block_size_x": 16, "block_size_y": 1, "tile_size_x": 2, "tile_size_y": 4, "read_only": 1, "use_padding": 0, "use_shmem": 0, "use_cmem": 1, "filter_height": 15, "filter_width": 15, "time": 2.2540850043296814, "times": [2.287385940551758, 2.2590670585632324, 2.2521860599517822, 2.2513859272003174, 2.249785900115967, 2.2523460388183594, 2.253145933151245, 2.254746913909912, 2.2505860328674316, 2.2544260025024414, 2.2547459602355957, 2.2517058849334717, 2.252825975418091, 2.2528269290924072, 2.25506591796875, 2.253786087036133, 2.2531468868255615, 2.252985954284668, 2.2542660236358643, 2.252985954284668, 2.2533059120178223, 2.253145933151245, 2.2502670288085938, 2.253786087036133, 2.2510669231414795, 2.249785900115967, 2.2534658908843994, 2.249908924102783, 2.252825975418091, 2.253786087036133, 2.2526659965515137, 2.2573060989379883], "compile_time": 985.8970218338072, "verification_time": 0, "benchmark_time": 73.22301901876926, "GFLOP/s": 3349.36224033181, "strategy_time": 0, "framework_time": 1.3628602027893066, "timestamp": "2023-12-21 10:45:41.668061+00:00"},
"16,1,2,4,1,0,1,1,15,15": {"block_size_x": 16, "block_size_y": 1, "tile_size_x": 2, "tile_size_y": 4, "read_only": 1, "use_padding": 0, "use_shmem": 1, "use_cmem": 1, "filter_height": 15, "filter_width": 15, "time": 3.672501266002655, "times": [3.7016420364379883, 3.6742820739746094, 3.6698029041290283, 3.6666030883789062, 3.669002056121826, 3.6650021076202393, 3.6622819900512695, 3.6645219326019287, 3.6635630130767822, 3.661642074584961, 3.6645219326019287, 3.666282892227173, 3.664522886276245, 3.662761926651001, 3.666282892227173, 3.665482997894287, 3.858083963394165, 3.667881965637207, 3.665961980819702, 3.664362907409668, 3.6677229404449463, 3.670283079147339, 3.6640429496765137, 3.6650021076202393, 3.662921905517578, 3.6648430824279785, 3.662921905517578, 3.6622819900512695, 3.664202928543091, 3.6627631187438965, 3.6643619537353516, 3.664202928543091], "compile_time": 883.4149949252605, "verification_time": 0, "benchmark_time": 119.58252172917128, "GFLOP/s": 2055.750741297237, "strategy_time": 0, "framework_time": 1.3849930837750435, "timestamp": "2023-12-21 10:45:42.672459+00:00"},
"16,1,2,4,1,1,1,1,15,15": {"block_size_x": 16, "block_size_y": 1, "tile_size_x": 2, "tile_size_y": 4, "read_only": 1, "use_padding": 1, "use_shmem": 1, "use_cmem": 1, "filter_height": 15, "filter_width": 15, "time": 3.666209951043129, "times": [3.704521894454956, 3.6712429523468018, 3.669322967529297, 3.665802001953125, 3.6640429496765137, 3.6646831035614014, 3.66388201713562, 3.667881965637207, 3.664202928543091, 3.664202928543091, 3.664681911468506, 3.662282943725586, 3.662442922592163, 3.6619629859924316, 3.663243055343628, 3.6645219326019287, 3.6644411087036133, 3.662282943725586, 3.6645219326019287, 3.662761926651001, 3.673801898956299, 3.663722038269043, 3.6627631187438965, 3.663403034210205, 3.6682019233703613, 3.6651620864868164, 3.665163040161133, 3.6630818843841553, 3.667562961578369, 3.6651620864868164, 3.6632421016693115, 3.664522886276245], "compile_time": 885.1803950965405, "verification_time": 0, "benchmark_time": 119.39964815974236, "GFLOP/s": 2059.2784649040373, "strategy_time": 0, "framework_time": 1.279427669942379, "timestamp": "2023-12-21 10:45:43.678334+00:00"},
"16,1,3,1,0,0,0,1,15,15": {"block_size_x": 16, "block_size_y": 1, "tile_size_x": 3, "tile_size_y": 1, "read_only": 0, "use_padding": 0, "use_shmem": 0, "use_cmem": 1, "filter_height": 15, "filter_width": 15, "time": 98.68609976768494, "times": [98.73167419433594, 98.6534652709961, 98.7041244506836, 98.61058044433594, 98.635986328125, 98.7404556274414, 98.75115203857422, 98.59880828857422, 98.70358276367188, 98.76373291015625, 98.65613555908203, 98.70391082763672, 98.6671371459961, 98.59037017822266, 98.63126373291016, 98.64437866210938, 98.78759765625, 98.71809387207031, 98.64954376220703, 98.64059448242188, 98.65007019042969, 98.5600814819336, 98.72560119628906, 98.73636627197266, 98.61102294921875, 98.81018829345703, 98.87379455566406, 98.76954650878906, 98.65203857421875, 98.66452026367188, 98.64254760742188, 98.67682647705078], "compile_time": 2369.4319841451943, "verification_time": 0, "benchmark_time": 3159.4343902543187, "GFLOP/s": 76.50264036954258, "strategy_time": 0, "framework_time": 1.328793354332447, "timestamp": "2023-12-21 10:45:49.208545+00:00"},
"16,1,3,1,0,0,1,1,15,15": {"block_size_x": 16, "block_size_y": 1, "tile_size_x": 3, "tile_size_y": 1, "read_only": 0, "use_padding": 0, "use_shmem": 1, "use_cmem": 1, "filter_height": 15, "filter_width": 15, "time": 34.5080748796463, "times": [34.58456039428711, 34.473209381103516, 34.53416061401367, 34.510982513427734, 34.517520904541016, 34.53752136230469, 34.50360107421875, 34.51926803588867, 34.524879455566406, 34.53410720825195, 34.52648162841797, 34.45603561401367, 34.50664138793945, 34.498252868652344, 34.48984146118164, 34.563140869140625, 34.51736068725586, 34.50239181518555, 34.51927947998047, 34.48127365112305, 34.473838806152344, 34.47782897949219, 34.466800689697266, 34.45555877685547, 34.585838317871094, 34.42529296875, 34.54008102416992, 34.53694534301758, 34.52360153198242, 34.46164321899414, 34.5125617980957, 34.497894287109375], "compile_time": 545.2979612164199, "verification_time": 0, "benchmark_time": 1105.829011183232, "GFLOP/s": 218.78204525553014, "strategy_time": 0, "framework_time": 1.4575025998055935, "timestamp": "2023-12-21 10:45:50.861145+00:00"},
"16,1,3,1,0,1,1,1,15,15": {"block_size_x": 16, "block_size_y": 1, "tile_size_x": 3, "tile_size_y": 1, "read_only": 0, "use_padding": 1, "use_shmem": 1, "use_cmem": 1, "filter_height": 15, "filter_width": 15, "time": 38.03405463695526, "times": [38.106361389160156, 38.13273239135742, 37.998680114746094, 38.050376892089844, 38.010520935058594, 38.00154113769531, 38.017879486083984, 38.04538345336914, 38.03356170654297, 38.00864791870117, 38.03900146484375, 38.073455810546875, 37.99932098388672, 38.03961944580078, 38.03036117553711, 38.05839920043945, 38.02587890625, 38.04607009887695, 38.05788040161133, 38.109981536865234, 38.03868103027344, 37.990413665771484, 38.01227951049805, 38.00949478149414, 38.005401611328125, 37.96745300292969, 37.97867965698242, 37.99745559692383, 38.04636001586914, 38.07505416870117, 38.04859924316406, 38.03422164916992], "compile_time": 547.7033513598144, "verification_time": 0, "benchmark_time": 1218.6060608364642, "GFLOP/s": 198.49966752333557, "strategy_time": 0, "framework_time": 1.4703567139804363, "timestamp": "2023-12-21 10:45:52.628940+00:00"},
"16,1,3,1,1,0,0,1,15,15": {"block_size_x": 16, "block_size_y": 1, "tile_size_x": 3, "tile_size_y": 1, "read_only": 1, "use_padding": 0, "use_shmem": 0, "use_cmem": 1, "filter_height": 15, "filter_width": 15, "time": 97.19803404808044, "times": [97.33732604980469, 97.24298095703125, 97.2463607788086, 97.3448486328125, 97.23310852050781, 97.19416809082031, 97.11902618408203, 97.13424682617188, 97.21748352050781, 97.18643188476562, 97.15167236328125, 97.1552505493164, 97.24845123291016, 97.15782928466797, 97.1886978149414, 97.2108383178711, 97.16265106201172, 97.14901733398438, 97.14378356933594, 97.16767883300781, 97.14498901367188, 97.25428771972656, 97.161376953125, 97.18030548095703, 97.27118682861328, 97.26949310302734, 97.2184829711914, 97.15343475341797, 97.22911071777344, 97.15243530273438, 97.072509765625, 97.23762512207031], "compile_time": 4582.197329029441, "verification_time": 0, "benchmark_time": 3111.8997908197343, "GFLOP/s": 77.6738673157258, "strategy_time": 0, "framework_time": 1.4969599433243275, "timestamp": "2023-12-21 10:46:00.324549+00:00"},
"16,1,3,1,1,0,1,1,15,15": {"block_size_x": 16, "block_size_y": 1, "tile_size_x": 3, "tile_size_y": 1, "read_only": 1, "use_padding": 0, "use_shmem": 1, "use_cmem": 1, "filter_height": 15, "filter_width": 15, "time": 34.47822093963623, "times": [34.5872802734375, 34.46943664550781, 34.49720001220703, 34.48906326293945, 34.44855880737305, 34.488521575927734, 34.4410400390625, 34.47473907470703, 34.44776153564453, 34.453895568847656, 34.48231887817383, 34.4259147644043, 34.46311950683594, 34.43720245361328, 34.49879837036133, 34.503822326660156, 34.54888153076172, 34.451438903808594, 34.444881439208984, 34.42329788208008, 34.43592071533203, 34.39781951904297, 34.45991897583008, 34.50456619262695, 34.45783996582031, 34.527034759521484, 34.54056167602539, 34.453834533691406, 34.49095916748047, 34.508880615234375, 34.55064010620117, 34.497920989990234], "compile_time": 544.6916869841516, "verification_time": 0, "benchmark_time": 1104.7294898889959, "GFLOP/s": 218.97148385985295, "strategy_time": 0, "framework_time": 1.5526977367699146, "timestamp": "2023-12-21 10:46:01.975540+00:00"},
"16,1,3,1,1,1,1,1,15,15": {"block_size_x": 16, "block_size_y": 1, "tile_size_x": 3, "tile_size_y": 1, "read_only": 1, "use_padding": 1, "use_shmem": 1, "use_cmem": 1, "filter_height": 15, "filter_width": 15, "time": 37.99961173534393, "times": [38.128604888916016, 38.04466247558594, 38.011478424072266, 37.98209762573242, 37.9841194152832, 37.988990783691406, 38.01676559448242, 37.97002410888672, 37.988121032714844, 38.008750915527344, 37.98971939086914, 37.929107666015625, 38.005882263183594, 38.176025390625, 37.984439849853516, 38.07292175292969, 37.98699951171875, 38.02482986450195, 38.00107955932617, 38.00484085083008, 38.00140380859375, 37.950958251953125, 37.952598571777344, 37.944358825683594, 37.97211837768555, 37.961265563964844, 37.97515869140625, 38.01637649536133, 37.96268081665039, 38.043296813964844, 37.934200286865234, 37.973697662353516], "compile_time": 546.9733569771051, "verification_time": 0, "benchmark_time": 1217.6133370958269, "GFLOP/s": 198.679587901628, "strategy_time": 0, "framework_time": 1.4027082361280918, "timestamp": "2023-12-21 10:46:03.741545+00:00"},
"16,1,3,2,0,0,0,1,15,15": {"block_size_x": 16, "block_size_y": 1, "tile_size_x": 3, "tile_size_y": 2, "read_only": 0, "use_padding": 0, "use_shmem": 0, "use_cmem": 1, "filter_height": 15, "filter_width": 15, "time": 85.62335181236267, "times": [85.66253662109375, 85.63343811035156, 85.60537719726562, 85.68148040771484, 85.62982177734375, 85.61202239990234, 85.61944580078125, 85.66622161865234, 85.6004867553711, 85.65185546875, 85.59765625, 85.5984115600586, 85.6182861328125, 85.603271484375, 85.61274719238281, 85.63694763183594, 85.64884948730469, 85.6467514038086, 85.60003662109375, 85.64610290527344, 85.6430892944336, 85.60179901123047, 85.65428924560547, 85.58256530761719, 85.56742095947266, 85.5859146118164, 85.63264465332031, 85.60225677490234, 85.63096618652344, 85.6312026977539, 85.63207244873047, 85.61128997802734], "compile_time": 1634.183089248836, "verification_time": 0, "benchmark_time": 2741.732602007687, "GFLOP/s": 88.1739273246943, "strategy_time": 0, "framework_time": 1.4202524907886982, "timestamp": "2023-12-21 10:46:08.118898+00:00"},
"16,1,3,2,0,0,1,1,15,15": {"block_size_x": 16, "block_size_y": 1, "tile_size_x": 3, "tile_size_y": 2, "read_only": 0, "use_padding": 0, "use_shmem": 1, "use_cmem": 1, "filter_height": 15, "filter_width": 15, "time": 43.38883113861084, "times": [43.65410614013672, 43.301998138427734, 43.38850402832031, 43.24988555908203, 43.362422943115234, 43.33620834350586, 43.31138229370117, 43.37091064453125, 43.411224365234375, 43.354225158691406, 43.38386535644531, 43.37411117553711, 43.38274383544922, 43.33819580078125, 43.361785888671875, 43.41218948364258, 43.47122573852539, 43.40782165527344, 43.37410354614258, 43.398197174072266, 43.315223693847656, 43.35645294189453, 43.38866424560547, 43.58438491821289, 43.34978485107422, 43.36153030395508, 43.440345764160156, 43.43008804321289, 43.43490219116211, 43.393497467041016, 43.33602523803711, 43.40658950805664], "compile_time": 866.5564809925854, "verification_time": 0, "benchmark_time": 1389.9862617254257, "GFLOP/s": 174.00208767738923, "strategy_time": 0, "framework_time": 1.467953436076641, "timestamp": "2023-12-21 10:46:10.376924+00:00"},
"16,1,3,2,0,1,1,1,15,15": {"block_size_x": 16, "block_size_y": 1, "tile_size_x": 3, "tile_size_y": 2, "read_only": 0, "use_padding": 1, "use_shmem": 1, "use_cmem": 1, "filter_height": 15, "filter_width": 15, "time": 46.571053862571716, "times": [46.65670394897461, 46.56511306762695, 46.56630325317383, 46.576576232910156, 46.653343200683594, 46.56465530395508, 46.613502502441406, 46.553062438964844, 46.59734344482422, 46.55527877807617, 46.52790069580078, 46.560760498046875, 46.565025329589844, 46.6407356262207, 46.55750274658203, 46.54627990722656, 46.5491828918457, 46.4996337890625, 46.55046463012695, 46.55791473388672, 46.60182571411133, 46.57573318481445, 46.61174392700195, 46.546630859375, 46.55366516113281, 46.57267761230469, 46.571102142333984, 46.58340835571289, 46.53525924682617, 46.54475784301758, 46.552703857421875, 46.566932678222656], "compile_time": 866.0695780999959, "verification_time": 0, "benchmark_time": 1491.8922651559114, "GFLOP/s": 162.11244053610713, "strategy_time": 0, "framework_time": 1.3769157230854034, "timestamp": "2023-12-21 10:46:12.736278+00:00"},
