SampleCacheFiles/convolution_MI50.json
{
"device_name": "AMD Instinct MI50/MI60",
"kernel_name": "convolution_kernel",
"problem_size": [
4096,
4096
],
"tune_params_keys": [
"block_size_x",
"block_size_y",
"tile_size_x",
"tile_size_y",
"read_only",
"use_padding"
],
"tune_params": {
"block_size_x": [
16,
32,
48,
64,
80,
96,
112,
128,
144,
160,
176,
192,
208,
224,
240,
256
],
"block_size_y": [
1,
2,
4,
8,
16
],
"tile_size_x": [
1,
2,
3,
4
],
"tile_size_y": [
1,
2,
3,
4
],
"read_only": [
0,
1
],
"use_padding": [
0,
1
]
},
"objective": "time",
"cache": {
"16,1,1,1,0,0": {"block_size_x": 16, "block_size_y": 1, "tile_size_x": 1, "tile_size_y": 1, "read_only": 0, "use_padding": 0, "time": 10.861857891082764, "times": [11.917744636535645, 10.855506896972656, 10.864147186279297, 10.856947898864746, 10.863507270812988, 10.827347755432129, 10.820947647094727, 10.82558822631836, 10.817907333374023, 10.823187828063965, 10.8223876953125, 10.81758975982666, 10.819510459899902, 10.823028564453125, 10.823348999023438, 10.825429916381836, 10.823988914489746, 10.823508262634277, 10.827507972717285, 10.823347091674805, 10.818707466125488, 10.821268081665039, 10.823347091674805, 10.821268081665039, 10.825428009033203, 10.826067924499512, 10.821746826171875, 10.824308395385742, 10.824466705322266, 10.823827743530273, 10.825907707214355, 10.82062816619873], "compile_time": 481.3333684578538, "verification_time": 0, "benchmark_time": 349.77993555366993, "GFLOP/s": 695.0695981944395, "strategy_time": 0, "framework_time": 58.37807524949312, "timestamp": "2023-05-18 08:28:28.913896+00:00"},
"16,1,1,1,0,1": {"block_size_x": 16, "block_size_y": 1, "tile_size_x": 1, "tile_size_y": 1, "read_only": 0, "use_padding": 1, "time": 13.243575721979141, "times": [14.270063400268555, 13.206544876098633, 13.210225105285645, 13.21214485168457, 13.209426879882812, 13.212786674499512, 13.212467193603516, 13.211827278137207, 13.213106155395508, 13.207027435302734, 13.204147338867188, 13.211346626281738, 13.207507133483887, 13.2057466506958, 13.214067459106445, 13.209587097167969, 13.21182632446289, 13.212306022644043, 13.2057466506958, 13.21550464630127, 13.20446491241455, 13.208305358886719, 13.213584899902344, 13.214545249938965, 13.219184875488281, 13.213584899902344, 13.205904960632324, 13.217744827270508, 13.212143898010254, 13.206544876098633, 13.207024574279785, 13.20798397064209], "compile_time": 446.6291693970561, "verification_time": 0, "benchmark_time": 425.6775872781873, "GFLOP/s": 570.0686399572874, "strategy_time": 0, "framework_time": 1.764737069606781, "timestamp": "2023-05-18 08:28:29.788006+00:00"},
"16,1,1,1,1,0": {"block_size_x": 16, "block_size_y": 1, "tile_size_x": 1, "tile_size_y": 1, "read_only": 1, "use_padding": 0, "time": 9.806164383888245, "times": [10.861106872558594, 9.814229011535645, 9.816308975219727, 9.816629409790039, 9.818229675292969, 9.8211088180542, 9.779829978942871, 9.765589714050293, 9.76526927947998, 9.760628700256348, 9.76254940032959, 9.761589050292969, 9.764948844909668, 9.763351440429688, 9.762551307678223, 9.765270233154297, 9.762229919433594, 9.764949798583984, 9.761429786682129, 9.763991355895996, 9.759349822998047, 9.765270233154297, 9.763348579406738, 9.757429122924805, 9.763348579406738, 9.764148712158203, 9.762550354003906, 9.758869171142578, 9.763029098510742, 9.7644681930542, 9.759188652038574, 9.7644681930542], "compile_time": 483.8743507862091, "verification_time": 0, "benchmark_time": 315.411320887506, "GFLOP/s": 769.8980870037635, "strategy_time": 0, "framework_time": 1.9795531406998634, "timestamp": "2023-05-18 08:28:30.589296+00:00"},
"16,1,1,1,1,1": {"block_size_x": 16, "block_size_y": 1, "tile_size_x": 1, "tile_size_y": 1, "read_only": 1, "use_padding": 1, "time": 12.268521666526794, "times": [13.291343688964844, 12.242707252502441, 12.244626998901367, 12.240306854248047, 12.22526741027832, 12.24030590057373, 12.240466117858887, 12.230384826660156, 12.234545707702637, 12.236305236816406, 12.23598575592041, 12.235507011413574, 12.233906745910645, 12.237107276916504, 12.236307144165039, 12.234227180480957, 12.231986999511719, 12.235186576843262, 12.2340669631958, 12.23022747039795, 12.234387397766113, 12.237907409667969, 12.238546371459961, 12.233906745910645, 12.235986709594727, 12.236626625061035, 12.239506721496582, 12.232625961303711, 12.233746528625488, 12.233748435974121, 12.235668182373047, 12.229267120361328], "compile_time": 442.1665044501424, "verification_time": 0, "benchmark_time": 394.1053692251444, "GFLOP/s": 615.3754629295385, "strategy_time": 0, "framework_time": 1.7942925915122032, "timestamp": "2023-05-18 08:28:31.427384+00:00"},
"16,1,1,2,0,0": {"block_size_x": 16, "block_size_y": 1, "tile_size_x": 1, "tile_size_y": 2, "read_only": 0, "use_padding": 0, "time": 6.844917789101601, "times": [7.795510768890381, 6.84719181060791, 6.810873031616211, 6.8115129470825195, 6.810873031616211, 6.812633037567139, 6.8113532066345215, 6.815352916717529, 6.811832904815674, 6.813111782073975, 6.81199312210083, 6.8119940757751465, 6.812472820281982, 6.814393043518066, 6.809274196624756, 6.814393043518066, 6.814393043518066, 6.814393997192383, 6.812313079833984, 6.813113212585449, 6.814551830291748, 6.81439208984375, 6.817752838134766, 6.816472053527832, 6.816952228546143, 6.812471866607666, 6.812472820281982, 6.811831951141357, 6.81199312210083, 6.8134331703186035, 6.812952995300293, 6.813113212585449], "compile_time": 530.4941227659583, "verification_time": 0, "benchmark_time": 220.54256033152342, "GFLOP/s": 1102.9712017901252, "strategy_time": 0, "framework_time": 1.7149094492197037, "timestamp": "2023-05-18 08:28:32.180165+00:00"},
"16,1,1,2,0,1": {"block_size_x": 16, "block_size_y": 1, "tile_size_x": 1, "tile_size_y": 2, "read_only": 0, "use_padding": 1, "time": 8.236651629209518, "times": [9.28911018371582, 8.199511528015137, 8.200471878051758, 8.203672409057617, 8.203512191772461, 8.204952239990234, 8.204792022705078, 8.201592445373535, 8.202391624450684, 8.202871322631836, 8.207032203674316, 8.205751419067383, 8.200470924377441, 8.20095157623291, 8.20703125, 8.197272300720215, 8.203672409057617, 8.201910972595215, 8.203512191772461, 8.204951286315918, 8.204631805419922, 8.197431564331055, 8.202231407165527, 8.203831672668457, 8.206071853637695, 8.202390670776367, 8.196791648864746, 8.202871322631836, 8.199991226196289, 8.206551551818848, 8.20383071899414, 8.20079231262207], "compile_time": 568.971692584455, "verification_time": 0, "benchmark_time": 265.9472534433007, "GFLOP/s": 916.6039235198973, "strategy_time": 0, "framework_time": 1.8306914716959, "timestamp": "2023-05-18 08:28:33.016940+00:00"},
"16,1,1,2,1,0": {"block_size_x": 16, "block_size_y": 1, "tile_size_x": 1, "tile_size_y": 2, "read_only": 1, "use_padding": 0, "time": 6.30660842359066, "times": [7.191990852355957, 6.419194221496582, 6.272314071655273, 6.270072937011719, 6.268953800201416, 6.268154144287109, 6.26943302154541, 6.272953987121582, 6.271513938903809, 6.275834083557129, 6.269914150238037, 6.272472858428955, 6.270713806152344, 6.2737531661987305, 6.272633075714111, 6.27471399307251, 6.272792816162109, 6.274233818054199, 6.276313781738281, 6.274874210357666, 6.273593902587891, 6.272472858428955, 6.2739129066467285, 6.276793003082275, 6.274713039398193, 6.2737531661987305, 6.273433208465576, 6.27759313583374, 6.2759928703308105, 6.2743940353393555, 6.275673866271973, 6.276312828063965], "compile_time": 529.4405315071344, "verification_time": 0, "benchmark_time": 203.91689334064722, "GFLOP/s": 1197.1168483775245, "strategy_time": 0, "framework_time": 1.6738232225179672, "timestamp": "2023-05-18 08:28:33.752003+00:00"},
"16,1,1,2,1,1": {"block_size_x": 16, "block_size_y": 1, "tile_size_x": 1, "tile_size_y": 2, "read_only": 1, "use_padding": 1, "time": 7.749652177095413, "times": [8.732629776000977, 7.72687292098999, 7.72687292098999, 7.726232051849365, 7.722231864929199, 7.725592136383057, 7.722072124481201, 7.722712993621826, 7.721912860870361, 7.720632076263428, 7.725272178649902, 7.718071937561035, 7.715191841125488, 7.718233108520508, 7.719192028045654, 7.711512088775635, 7.716631889343262, 7.71071195602417, 7.714392185211182, 7.714712142944336, 7.717591762542725, 7.713111877441406, 7.717751979827881, 7.718711853027344, 7.712791919708252, 7.716793060302734, 7.714713096618652, 7.71503210067749, 7.71071195602417, 7.712791919708252, 7.710553169250488, 7.716631889343262], "compile_time": 526.8261497840285, "verification_time": 0, "benchmark_time": 250.09067356586456, "GFLOP/s": 974.2046517021441, "strategy_time": 0, "framework_time": 1.6115549951791763, "timestamp": "2023-05-18 08:28:34.530558+00:00"},
"16,1,1,3,0,0": {"block_size_x": 16, "block_size_y": 1, "tile_size_x": 1, "tile_size_y": 3, "read_only": 0, "use_padding": 0, "time": 78.36010503768921, "times": [79.24359893798828, 78.3595962524414, 78.38407897949219, 78.31768035888672, 78.31880187988281, 78.39240264892578, 78.34632110595703, 78.34983825683594, 78.37928009033203, 78.3077621459961, 78.38056182861328, 78.37239837646484, 78.43399810791016, 78.33560180664062, 78.22328186035156, 78.3266372680664, 78.33544158935547, 78.3080825805664, 78.29991912841797, 78.31816101074219, 78.2947998046875, 78.21160125732422, 78.30216217041016, 78.3560791015625, 78.3431167602539, 78.25879669189453, 78.30696105957031, 78.38279724121094, 78.29048156738281, 78.35336303710938, 78.3427963256836, 78.34696197509766], "compile_time": 712.1937908232212, "verification_time": 0, "benchmark_time": 2510.179099626839, "GFLOP/s": 96.34682337866653, "strategy_time": 0, "framework_time": 1.7506303265690804, "timestamp": "2023-05-18 08:28:37.754717+00:00"},
"16,1,1,3,0,1": {"block_size_x": 16, "block_size_y": 1, "tile_size_x": 1, "tile_size_y": 3, "read_only": 0, "use_padding": 1, "time": 75.96861529350281, "times": [76.466796875, 75.92584991455078, 75.92183685302734, 75.90856170654297, 75.92920684814453, 75.92887878417969, 75.93416595458984, 75.94904327392578, 75.96871948242188, 75.92263793945312, 75.91255950927734, 75.9404067993164, 75.9594497680664, 75.9234390258789, 75.96343994140625, 75.99880981445312, 75.94088745117188, 75.9426498413086, 75.97352600097656, 75.96553039550781, 75.94568634033203, 75.97864532470703, 75.98616790771484, 75.96009063720703, 75.95352935791016, 75.93480682373047, 75.96952819824219, 76.00025177001953, 75.97784423828125, 75.89176940917969, 76.02456665039062, 75.99640655517578], "compile_time": 746.856871061027, "verification_time": 0, "benchmark_time": 2433.2909053191543, "GFLOP/s": 99.37981850573087, "strategy_time": 0, "framework_time": 2.1785590797662735, "timestamp": "2023-05-18 08:28:40.937085+00:00"},
"16,1,1,3,1,0": {"block_size_x": 16, "block_size_y": 1, "tile_size_x": 1, "tile_size_y": 3, "read_only": 1, "use_padding": 0, "time": 75.95475792884827, "times": [76.44168853759766, 75.95704650878906, 75.97721099853516, 75.9780044555664, 75.94824981689453, 75.97432708740234, 75.9308090209961, 75.93560791015625, 75.9192886352539, 75.91976928710938, 75.9600830078125, 75.9215316772461, 75.93753051757812, 75.94232940673828, 75.91768646240234, 75.97016906738281, 75.9476089477539, 75.9565658569336, 75.9296875, 75.89897155761719, 75.9684066772461, 75.92776489257812, 75.9189682006836, 75.91960906982422, 75.93880462646484, 75.90216827392578, 75.93400573730469, 75.91304779052734, 75.94072723388672, 75.91529083251953, 75.95816802978516, 75.95112609863281], "compile_time": 758.9684557169676, "verification_time": 0, "benchmark_time": 2432.8701803460717, "GFLOP/s": 99.3979495935243, "strategy_time": 0, "framework_time": 2.0464593544602394, "timestamp": "2023-05-18 08:28:44.131010+00:00"},
"16,1,1,3,1,1": {"block_size_x": 16, "block_size_y": 1, "tile_size_x": 1, "tile_size_y": 3, "read_only": 1, "use_padding": 1, "time": 76.32239294052124, "times": [76.85992431640625, 76.27944946289062, 76.30616760253906, 76.34520721435547, 76.29448699951172, 76.3340072631836, 76.33560943603516, 76.30841064453125, 76.28824615478516, 76.25128936767578, 76.31656646728516, 76.32120513916016, 76.27320861816406, 76.28760528564453, 76.31608581542969, 76.29721069335938, 76.29960632324219, 76.34056854248047, 76.29432678222656, 76.29544830322266, 76.30841064453125, 76.2952880859375, 76.27208709716797, 76.31369018554688, 76.30345153808594, 76.30088806152344, 76.28856658935547, 76.32537078857422, 76.30648803710938, 76.33240509033203, 76.31993103027344, 76.30536651611328], "compile_time": 702.3890279233456, "verification_time": 0, "benchmark_time": 2444.3200826644897, "GFLOP/s": 98.91916263531711, "strategy_time": 0, "framework_time": 1.6994532197713852, "timestamp": "2023-05-18 08:28:47.279441+00:00"},
"16,1,1,4,0,0": {"block_size_x": 16, "block_size_y": 1, "tile_size_x": 1, "tile_size_y": 4, "read_only": 0, "use_padding": 0, "time": 5.596264645457268, "times": [6.39135217666626, 5.811514854431152, 5.561914920806885, 5.563673973083496, 5.563035011291504, 5.564955234527588, 5.566073894500732, 5.561755180358887, 5.563354969024658, 5.563994884490967, 5.5585551261901855, 5.563994884490967, 5.562395095825195, 5.560314178466797, 5.563994884490967, 5.56399393081665, 5.562554836273193, 5.5630340576171875, 5.560635089874268, 5.56319522857666, 5.562233924865723, 5.563035011291504, 5.563354969024658, 5.563835144042969, 5.562874794006348, 5.5590338706970215, 5.561755180358887, 5.560473918914795, 5.56271505355835, 5.561755180358887, 5.561913967132568, 5.56319522857666], "compile_time": 676.2059675529599, "verification_time": 0, "benchmark_time": 180.6797320023179, "GFLOP/s": 1349.0690091163683, "strategy_time": 0, "framework_time": 1.5933606773614883, "timestamp": "2023-05-18 08:28:48.137942+00:00"},
"16,1,1,4,0,1": {"block_size_x": 16, "block_size_y": 1, "tile_size_x": 1, "tile_size_y": 4, "read_only": 0, "use_padding": 1, "time": 5.665734604001045, "times": [6.479832172393799, 5.807835102081299, 5.640793800354004, 5.639514923095703, 5.636474132537842, 5.637115001678467, 5.63807487487793, 5.639995098114014, 5.640954971313477, 5.640153884887695, 5.640315055847168, 5.6348748207092285, 5.630235195159912, 5.631514072418213, 5.62607479095459, 5.629593849182129, 5.634554862976074, 5.630713939666748, 5.631354808807373, 5.629114151000977, 5.632474899291992, 5.631515026092529, 5.6327948570251465, 5.629115104675293, 5.634873867034912, 5.632154941558838, 5.6347150802612305, 5.6249542236328125, 5.632474899291992, 5.6367950439453125, 5.632955074310303, 5.629594802856445], "compile_time": 680.1958791911602, "verification_time": 0, "benchmark_time": 183.38907230645418, "GFLOP/s": 1332.5275057304127, "strategy_time": 0, "framework_time": 1.6079898923635483, "timestamp": "2023-05-18 08:28:49.003163+00:00"},
"16,1,1,4,1,0": {"block_size_x": 16, "block_size_y": 1, "tile_size_x": 1, "tile_size_y": 4, "read_only": 1, "use_padding": 0, "time": 5.301659852266312, "times": [6.042713165283203, 5.55071496963501, 5.271194934844971, 5.273914813995361, 5.272154808044434, 5.273115158081055, 5.275354862213135, 5.273914813995361, 5.275195121765137, 5.272474765777588, 5.273914813995361, 5.273594856262207, 5.273435115814209, 5.274555206298828, 5.266234874725342, 5.266554832458496, 5.265275001525879, 5.263675212860107, 5.2638349533081055, 5.266395092010498, 5.267035007476807, 5.26687479019165, 5.263354778289795, 5.263354778289795, 5.266554832458496, 5.26463508605957, 5.263354778289795, 5.266554832458496, 5.266075134277344, 5.265275001525879, 5.266715049743652, 5.265113830566406], "compile_time": 676.4074880629778, "verification_time": 0, "benchmark_time": 171.56624607741833, "GFLOP/s": 1424.034625075521, "strategy_time": 0, "framework_time": 1.705964095890522, "timestamp": "2023-05-18 08:28:49.852868+00:00"},
"16,1,1,4,1,1": {"block_size_x": 16, "block_size_y": 1, "tile_size_x": 1, "tile_size_y": 4, "read_only": 1, "use_padding": 1, "time": 5.287274897098541, "times": [6.024473190307617, 5.596794128417969, 5.256315231323242, 5.25599479675293, 5.258874893188477, 5.25599479675293, 5.258874893188477, 5.25807523727417, 5.257595062255859, 5.257595062255859, 5.25807523727417, 5.256155014038086, 5.253594875335693, 5.249114990234375, 5.247994899749756, 5.24991512298584, 5.251194953918457, 5.24831485748291, 5.253914833068848, 5.2486348152160645, 5.250874996185303, 5.247194766998291, 5.253914833068848, 5.248475074768066, 5.250235080718994, 5.24991512298584, 5.249434947967529, 5.251355171203613, 5.248475074768066, 5.249434947967529, 5.24831485748291, 5.247674942016602], "compile_time": 676.4143807813525, "verification_time": 0, "benchmark_time": 171.24870512634516, "GFLOP/s": 1427.908960085094, "strategy_time": 0, "framework_time": 1.553916372358799, "timestamp": "2023-05-18 08:28:50.702111+00:00"},
"16,1,2,1,0,0": {"block_size_x": 16, "block_size_y": 1, "tile_size_x": 2, "tile_size_y": 1, "read_only": 0, "use_padding": 0, "time": 10.576794922351837, "times": [11.631668090820312, 10.599989891052246, 10.539030075073242, 10.540630340576172, 10.544150352478027, 10.543510437011719, 10.538390159606934, 10.539509773254395, 10.53966999053955, 10.546229362487793, 10.543350219726562, 10.545430183410645, 10.54127025604248, 10.540149688720703, 10.540470123291016, 10.538229942321777, 10.542388916015625, 10.539990425109863, 10.543350219726562, 10.537750244140625, 10.537110328674316, 10.539349555969238, 10.539349555969238, 10.541910171508789, 10.543669700622559, 10.546070098876953, 10.540630340576172, 10.535828590393066, 10.535670280456543, 10.539349555969238, 10.542710304260254, 10.540630340576172], "compile_time": 609.3385946005583, "verification_time": 0, "benchmark_time": 340.0570768862963, "GFLOP/s": 713.8029294720645, "strategy_time": 0, "framework_time": 1.696486957371235, "timestamp": "2023-05-18 08:28:51.653224+00:00"},
"16,1,2,1,0,1": {"block_size_x": 16, "block_size_y": 1, "tile_size_x": 2, "tile_size_y": 1, "read_only": 0, "use_padding": 1, "time": 10.576139837503433, "times": [11.633426666259766, 10.552949905395508, 10.552789688110352, 10.5523099899292, 10.551190376281738, 10.545269966125488, 10.540470123291016, 10.541430473327637, 10.540149688720703, 10.540789604187012, 10.535510063171387, 10.542710304260254, 10.534390449523926, 10.541110038757324, 10.54302978515625, 10.539189338684082, 10.53966999053955, 10.540630340576172, 10.537110328674316, 10.542389869689941, 10.535989761352539, 10.537749290466309, 10.547989845275879, 10.542550086975098, 10.539349555969238, 10.538229942321777, 10.538069725036621, 10.542869567871094, 10.539030075073242, 10.539990425109863, 10.54030990600586, 10.547829627990723], "compile_time": 615.3767583891749, "verification_time": 0, "benchmark_time": 340.3866598382592, "GFLOP/s": 713.8471423409401, "strategy_time": 0, "framework_time": 1.6460614278912544, "timestamp": "2023-05-18 08:28:52.610663+00:00"},
"16,1,2,1,1,0": {"block_size_x": 16, "block_size_y": 1, "tile_size_x": 2, "tile_size_y": 1, "read_only": 1, "use_padding": 0, "time": 9.737195700407028, "times": [10.712468147277832, 9.710070610046387, 9.7150297164917, 9.715351104736328, 9.718549728393555, 9.720951080322266, 9.716151237487793, 9.71743106842041, 9.702550888061523, 9.707189559936523, 9.704951286315918, 9.706391334533691, 9.702230453491211, 9.703190803527832, 9.704951286315918, 9.695990562438965, 9.704310417175293, 9.699670791625977, 9.702070236206055, 9.7036714553833, 9.705591201782227, 9.70879077911377, 9.702071189880371, 9.702230453491211, 9.697590827941895, 9.6951904296875, 9.702231407165527, 9.698711395263672, 9.700791358947754, 9.707509994506836, 9.704151153564453, 9.702230453491211], "compile_time": 610.5457162484527, "verification_time": 0, "benchmark_time": 313.4320816025138, "GFLOP/s": 775.351285143053, "strategy_time": 0, "framework_time": 1.586797647178173, "timestamp": "2023-05-18 08:28:53.536252+00:00"},
"16,1,2,1,1,1": {"block_size_x": 16, "block_size_y": 1, "tile_size_x": 2, "tile_size_y": 1, "read_only": 1, "use_padding": 1, "time": 9.73640051484108, "times": [10.770387649536133, 9.704951286315918, 9.701749801635742, 9.701750755310059, 9.704791069030762, 9.703829765319824, 9.701271057128906, 9.708150863647461, 9.698869705200195, 9.701590538024902, 9.698869705200195, 9.7036714553833, 9.707191467285156, 9.698870658874512, 9.704951286315918, 9.706709861755371, 9.705591201782227, 9.705430030822754, 9.69935131072998, 9.70398998260498, 9.698230743408203, 9.712150573730469, 9.697750091552734, 9.699991226196289, 9.704629898071289, 9.704791069030762, 9.706709861755371, 9.702871322631836, 9.703351020812988, 9.700630187988281, 9.702550888061523, 9.699190139770508], "compile_time": 609.4983359798789, "verification_time": 0, "benchmark_time": 313.3529108017683, "GFLOP/s": 775.4146091763592, "strategy_time": 0, "framework_time": 1.5195934101939201, "timestamp": "2023-05-18 08:28:54.460645+00:00"},
"16,1,2,2,0,0": {"block_size_x": 16, "block_size_y": 1, "tile_size_x": 2, "tile_size_y": 2, "read_only": 0, "use_padding": 0, "time": 6.583048596978188, "times": [7.490711212158203, 6.681593894958496, 6.553593158721924, 6.554714202880859, 6.555034160614014, 6.555994033813477, 6.557273864746094, 6.558873176574707, 6.556313991546631, 6.549114227294922, 6.547354221343994, 6.54783296585083, 6.5457539558410645, 6.5471930503845215, 6.547194004058838, 6.5473527908325195, 6.5478339195251465, 6.545913219451904, 6.550394058227539, 6.548793792724609, 6.547674179077148, 6.547032833099365, 6.547194004058838, 6.550232887268066, 6.54927396774292, 6.546712875366211, 6.547513961791992, 6.546072959899902, 6.545594215393066, 6.549114227294922, 6.5478339195251465, 6.544473171234131], "compile_time": 900.7640676572919, "verification_time": 0, "benchmark_time": 212.68649119883776, "GFLOP/s": 1146.8466454076543, "strategy_time": 0, "framework_time": 1.7056139186024666, "timestamp": "2023-05-18 08:28:55.575823+00:00"},
"16,1,2,2,0,1": {"block_size_x": 16, "block_size_y": 1, "tile_size_x": 2, "tile_size_y": 2, "read_only": 0, "use_padding": 1, "time": 6.581113561987877, "times": [7.4931111335754395, 6.652153968811035, 6.55167293548584, 6.5478339195251465, 6.545753002166748, 6.546393871307373, 6.5471930503845215, 6.550714015960693, 6.545114040374756, 6.550233840942383, 6.544474124908447, 6.5511932373046875, 6.545914173126221, 6.54943323135376, 6.547194004058838, 6.551033020019531, 6.549114227294922, 6.548954010009766, 6.546712875366211, 6.551514148712158, 6.54543399810791, 6.54783296585083, 6.548153877258301, 6.54943323135376, 6.551194190979004, 6.5492730140686035, 6.545914173126221, 6.546392917633057, 6.550394058227539, 6.551353931427002, 6.547033786773682, 6.547513008117676], "compile_time": 895.9284368902445, "verification_time": 0, "benchmark_time": 212.6891054213047, "GFLOP/s": 1147.1838510137393, "strategy_time": 0, "framework_time": 1.5865908935666084, "timestamp": "2023-05-18 08:28:56.686049+00:00"},
"16,1,2,2,1,0": {"block_size_x": 16, "block_size_y": 1, "tile_size_x": 2, "tile_size_y": 2, "read_only": 1, "use_padding": 0, "time": 6.125373810529709, "times": [6.977911949157715, 6.276312828063965, 6.093594074249268, 6.091993808746338, 6.093113899230957, 6.091194152832031, 6.090074062347412, 6.091353893280029, 6.092793941497803, 6.091993808746338, 6.087833881378174, 6.090394020080566, 6.092313766479492, 6.094873905181885, 6.092154026031494, 6.091993808746338, 6.093274116516113, 6.091033935546875, 6.08799409866333, 6.088953971862793, 6.09471321105957, 6.092793941497803, 6.093274116516113, 6.093274116516113, 6.093433856964111, 6.092793941497803, 6.092954158782959, 6.091673851013184, 6.088153839111328, 6.092473030090332, 6.091033935546875, 6.094233989715576], "compile_time": 902.6519870385528, "verification_time": 0, "benchmark_time": 197.7525418624282, "GFLOP/s": 1232.5365656903662, "strategy_time": 0, "framework_time": 1.5261946246027946, "timestamp": "2023-05-18 08:28:57.788015+00:00"},
"16,1,2,2,1,1": {"block_size_x": 16, "block_size_y": 1, "tile_size_x": 2, "tile_size_y": 2, "read_only": 1, "use_padding": 1, "time": 6.124218836426735, "times": [6.969111919403076, 6.236632823944092, 6.092154026031494, 6.090554237365723, 6.09407377243042, 6.09023380279541, 6.09183406829834, 6.090713977813721, 6.0915141105651855, 6.091353893280029, 6.092793941497803, 6.0945539474487305, 6.091194152832031, 6.093594074249268, 6.092154026031494, 6.09263277053833, 6.093753814697266, 6.088953971862793, 6.092793941497803, 6.089754104614258, 6.092792987823486, 6.090074062347412, 6.095993995666504, 6.093914031982422, 6.09567403793335, 6.091194152832031, 6.091353893280029, 6.094233989715576, 6.09183406829834, 6.093594074249268, 6.09183406829834, 6.092154026031494], "compile_time": 895.7113167271018, "verification_time": 0, "benchmark_time": 197.5434571504593, "GFLOP/s": 1232.76901130545, "strategy_time": 0, "framework_time": 1.8002046272158623, "timestamp": "2023-05-18 08:28:58.883097+00:00"},
"16,1,2,3,0,0": {"block_size_x": 16, "block_size_y": 1, "tile_size_x": 2, "tile_size_y": 3, "read_only": 0, "use_padding": 0, "time": 82.16762495040894, "times": [82.80760192871094, 82.1711196899414, 82.17272186279297, 82.1424789428711, 82.13448333740234, 82.1589584350586, 82.14727783203125, 82.10968017578125, 82.19608306884766, 82.11192321777344, 82.16551971435547, 82.1011962890625, 82.20887756347656, 82.1474380493164, 82.18856048583984, 82.15991973876953, 82.1285629272461, 82.20807647705078, 82.08663940429688, 82.14984130859375, 82.1450424194336, 82.11640167236328, 82.20471954345703, 82.14775848388672, 82.17047882080078, 82.1722412109375, 82.15399932861328, 82.06168365478516, 82.1439208984375, 82.18135833740234, 82.09639739990234, 82.07303619384766], "compile_time": 1566.1861514672637, "verification_time": 0, "benchmark_time": 2631.206908263266, "GFLOP/s": 91.88226146924093, "strategy_time": 0, "framework_time": 1.594862900674343, "timestamp": "2023-05-18 08:29:03.082106+00:00"},
"16,1,2,3,0,1": {"block_size_x": 16, "block_size_y": 1, "tile_size_x": 2, "tile_size_y": 3, "read_only": 0, "use_padding": 1, "time": 82.18648958206177, "times": [82.90071868896484, 82.21640014648438, 82.14695739746094, 82.14600372314453, 82.15383911132812, 82.13416290283203, 82.11544036865234, 82.18247985839844, 82.11016082763672, 82.18679809570312, 82.17896270751953, 82.15303802490234, 82.19735717773438, 82.20040130615234, 82.15544128417969, 82.16200256347656, 82.13944244384766, 82.1424789428711, 82.1661605834961, 82.2181625366211, 82.19671630859375, 82.16280364990234, 82.16999816894531, 82.17431640625, 82.1711196899414, 82.15847778320312, 82.14087677001953, 82.1546401977539, 82.16311645507812, 82.12999725341797, 82.19159698486328, 82.14759826660156], "compile_time": 1569.7456486523151, "verification_time": 0, "benchmark_time": 2632.306727580726, "GFLOP/s": 91.86117132380633, "strategy_time": 0, "framework_time": 1.7849141731858253, "timestamp": "2023-05-18 08:29:07.285986+00:00"},
"16,1,2,3,1,0": {"block_size_x": 16, "block_size_y": 1, "tile_size_x": 2, "tile_size_y": 3, "read_only": 1, "use_padding": 0, "time": 81.91721987724304, "times": [82.59751892089844, 81.89688110351562, 81.91079711914062, 81.93319702148438, 81.90455627441406, 81.962158203125, 81.89240264892578, 81.89176177978516, 81.93016052246094, 81.86248016357422, 81.89832305908203, 81.9127197265625, 81.87783813476562, 81.89832305908203, 81.92584228515625, 81.85623931884766, 81.86743927001953, 81.8762435913086, 81.88999938964844, 81.90264129638672, 81.89415740966797, 81.87911987304688, 81.91191864013672, 81.88152313232422, 81.92711639404297, 81.89608001708984, 81.87239837646484, 81.90071868896484, 81.89064025878906, 81.82231903076172, 81.92440032958984, 81.86312103271484], "compile_time": 1605.8991365134716, "verification_time": 0, "benchmark_time": 2623.3210219070315, "GFLOP/s": 92.16312774424797, "strategy_time": 0, "framework_time": 2.1496834233403206, "timestamp": "2023-05-18 08:29:11.517391+00:00"},
"16,1,2,3,1,1": {"block_size_x": 16, "block_size_y": 1, "tile_size_x": 2, "tile_size_y": 3, "read_only": 1, "use_padding": 1, "time": 81.91962504386902, "times": [82.60279846191406, 81.92632293701172, 81.88839721679688, 81.83255767822266, 81.88632202148438, 81.95063781738281, 81.93287658691406, 81.8843994140625, 81.88407897949219, 81.93592071533203, 81.90599822998047, 81.92120361328125, 81.85304260253906, 81.95240020751953, 81.94120025634766, 81.85768127441406, 81.91496276855469, 81.92359924316406, 81.88104248046875, 81.88040161132812, 81.85704040527344, 81.8936767578125, 81.86599731445312, 81.89256286621094, 81.8335189819336, 81.87703704833984, 81.91767883300781, 81.87000274658203, 81.97016143798828, 81.8690414428711, 81.91480255126953, 81.91063690185547], "compile_time": 1562.4806080013514, "verification_time": 0, "benchmark_time": 2623.3667274937034, "GFLOP/s": 92.1604218275781, "strategy_time": 0, "framework_time": 1.605224795639515, "timestamp": "2023-05-18 08:29:15.704870+00:00"},
"16,1,2,4,0,0": {"block_size_x": 16, "block_size_y": 1, "tile_size_x": 2, "tile_size_y": 4, "read_only": 0, "use_padding": 0, "time": 5.586894273757935, "times": [6.7041521072387695, 5.755993843078613, 5.5457539558410645, 5.542873859405518, 5.543034076690674, 5.546875, 5.54255485534668, 5.545114040374756, 5.545273780822754, 5.5449538230896, 5.547675132751465, 5.541594982147217, 5.546554088592529, 5.543834209442139, 5.543994903564453, 5.5449538230896, 5.546393871307373, 5.539993762969971, 5.541914939880371, 5.543034076690674, 5.5407938957214355, 5.5427141189575195, 5.5463948249816895, 5.5414347648620605, 5.542233943939209, 5.5427141189575195, 5.544634819030762, 5.547514915466309, 5.5415940284729, 5.547354221343994, 5.544475078582764, 5.542234897613525], "compile_time": 1537.68072091043, "verification_time": 0, "benchmark_time": 180.48178777098656, "GFLOP/s": 1351.3316755360368, "strategy_time": 0, "framework_time": 1.8617687746882439, "timestamp": "2023-05-18 08:29:17.424916+00:00"},
"16,1,2,4,0,1": {"block_size_x": 16, "block_size_y": 1, "tile_size_x": 2, "tile_size_y": 4, "read_only": 0, "use_padding": 1, "time": 5.5787342339754105, "times": [6.335832118988037, 5.822874069213867, 5.551033973693848, 5.552474021911621, 5.5534348487854, 5.554073810577393, 5.551514148712158, 5.550074100494385, 5.549593925476074, 5.539995193481445, 5.543515205383301, 5.544475078582764, 5.542873859405518, 5.541274070739746, 5.543193817138672, 5.543194770812988, 5.542233943939209, 5.542873859405518, 5.542873859405518, 5.5414347648620605, 5.542715072631836, 5.543193817138672, 5.542234897613525, 5.545754909515381, 5.543193817138672, 5.546393871307373, 5.544633865356445, 5.544634819030762, 5.5449538230896, 5.546234130859375, 5.5449538230896, 5.541755199432373], "compile_time": 1559.84668713063, "verification_time": 0, "benchmark_time": 180.38442358374596, "GFLOP/s": 1353.3082744864948, "strategy_time": 0, "framework_time": 1.5366151928901672, "timestamp": "2023-05-18 08:29:19.166711+00:00"},
"16,1,2,4,1,0": {"block_size_x": 16, "block_size_y": 1, "tile_size_x": 2, "tile_size_y": 4, "read_only": 1, "use_padding": 0, "time": 5.3419594168663025, "times": [6.048952102661133, 5.635354042053223, 5.3126349449157715, 5.311034202575684, 5.310235023498535, 5.308474063873291, 5.3100738525390625, 5.308794975280762, 5.30527400970459, 5.30719518661499, 5.306714057922363, 5.308475017547607, 5.304794788360596, 5.3100738525390625, 5.3105549812316895, 5.3057541847229, 5.308953762054443, 5.3055949211120605, 5.310234069824219, 5.308155059814453, 5.308633804321289, 5.311034202575684, 5.306554794311523, 5.304635047912598, 5.308955192565918, 5.3079938888549805, 5.309915065765381, 5.305434226989746, 5.307034015655518, 5.312475204467773, 5.312473773956299, 5.310235023498535], "compile_time": 1537.5525997951627, "verification_time": 0, "benchmark_time": 173.0319345369935, "GFLOP/s": 1413.2917551119901, "strategy_time": 0, "framework_time": 1.7136987298727036, "timestamp": "2023-05-18 08:29:20.879034+00:00"},
"16,1,2,4,1,1": {"block_size_x": 16, "block_size_y": 1, "tile_size_x": 2, "tile_size_y": 4, "read_only": 1, "use_padding": 1, "time": 5.337914347648621, "times": [6.0446319580078125, 5.495354175567627, 5.3175950050354, 5.315834045410156, 5.3145551681518555, 5.314713954925537, 5.307673931121826, 5.307034969329834, 5.30959415435791, 5.306234836578369, 5.304955005645752, 5.308155059814453, 5.3055949211120605, 5.3079938888549805, 5.306395053863525, 5.3100738525390625, 5.306553840637207, 5.3105549812316895, 5.3079938888549805, 5.307353973388672, 5.308955192565918, 5.305913925170898, 5.3100738525390625, 5.309915065765381, 5.310074806213379, 5.308313846588135, 5.309114933013916, 5.308313846588135, 5.304634094238281, 5.3105549812316895, 5.3100738525390625, 5.308474063873291], "compile_time": 1536.7696275934577, "verification_time": 0, "benchmark_time": 172.89268225431442, "GFLOP/s": 1414.362747001683, "strategy_time": 0, "framework_time": 1.4871805906295776, "timestamp": "2023-05-18 08:29:22.590205+00:00"},
"16,1,3,1,0,0": {"block_size_x": 16, "block_size_y": 1, "tile_size_x": 3, "tile_size_y": 1, "read_only": 0, "use_padding": 0, "time": 110.88850426673889, "times": [111.63716125488281, 107.03972625732422, 107.81204986572266, 108.33716583251953, 110.26612854003906, 111.42980194091797, 110.51892852783203, 109.88533020019531, 110.82308197021484, 115.5533218383789, 112.2891616821289, 115.01972198486328, 107.34772491455078, 112.98100280761719, 113.59892272949219, 109.300048828125, 111.25444030761719, 108.74740600585938, 108.60932922363281, 112.20323944091797, 111.44419860839844, 107.35700988769531, 109.5477294921875, 114.88996124267578, 113.3593978881836, 113.37460327148438, 107.6573257446289, 108.39476776123047, 113.8336410522461, 111.05699920654297, 110.33477020263672, 112.52803802490234], "compile_time": 999.9875100329518, "verification_time": 0, "benchmark_time": 3550.924953073263, "GFLOP/s": 68.08412873745068, "strategy_time": 0, "framework_time": 1.5866700559854507, "timestamp": "2023-05-18 08:29:27.142733+00:00"},
"16,1,3,1,0,1": {"block_size_x": 16, "block_size_y": 1, "tile_size_x": 3, "tile_size_y": 1, "read_only": 0, "use_padding": 1, "time": 130.78423643112183, "times": [132.35330200195312, 132.8611297607422, 126.51890563964844, 131.95729064941406, 130.84722900390625, 130.19361877441406, 131.28114318847656, 131.402099609375, 129.56834411621094, 130.6381072998047, 130.95249938964844, 130.0081787109375, 131.0485076904297, 129.61827087402344, 132.28817749023438, 129.77410888671875, 130.3624267578125, 130.1123504638672, 131.15264892578125, 131.35777282714844, 131.506103515625, 130.97122192382812, 130.45474243164062, 130.82369995117188, 130.00946044921875, 131.6732940673828, 131.33682250976562, 130.66082763671875, 129.91026306152344, 132.22418212890625, 130.1310577392578, 131.0977783203125], "compile_time": 1027.41021476686, "verification_time": 0, "benchmark_time": 4187.5876961275935, "GFLOP/s": 57.72673684550746, "strategy_time": 0, "framework_time": 2.0937472581863403, "timestamp": "2023-05-18 08:29:32.359857+00:00"},
"16,1,3,1,1,0": {"block_size_x": 16, "block_size_y": 1, "tile_size_x": 3, "tile_size_y": 1, "read_only": 1, "use_padding": 0, "time": 108.32867121696472, "times": [110.31076049804688, 110.13971710205078, 110.34867858886719, 108.91604614257812, 109.1786117553711, 106.82341003417969, 107.47764587402344, 110.07859802246094, 106.89620971679688, 108.12548828125, 106.40548706054688, 107.48725128173828, 108.29013061523438, 108.1763687133789, 108.69844818115234, 106.58805084228516, 109.59796142578125, 108.57173156738281, 110.88739776611328, 107.72036743164062, 107.84436798095703, 107.5208511352539, 106.90644836425781, 106.44197082519531, 108.7330093383789, 109.85572052001953, 108.84851837158203, 107.72357177734375, 109.50180053710938, 106.81396484375, 107.6810073852539, 107.92788696289062], "compile_time": 1029.5218471437693, "verification_time": 0, "benchmark_time": 3468.723095022142, "GFLOP/s": 69.69297338540305, "strategy_time": 0, "framework_time": 2.127581275999546, "timestamp": "2023-05-18 08:29:36.860287+00:00"},
"16,1,3,1,1,1": {"block_size_x": 16, "block_size_y": 1, "tile_size_x": 3, "tile_size_y": 1, "read_only": 1, "use_padding": 1, "time": 129.97681260108948, "times": [126.9222640991211, 130.66481018066406, 130.2654571533203, 130.01905822753906, 130.0342559814453, 131.16305541992188, 131.51617431640625, 125.90370178222656, 128.53298950195312, 132.23538208007812, 130.20770263671875, 129.9347381591797, 129.88609313964844, 130.78945922851562, 129.5017852783203, 129.89361572265625, 129.39425659179688, 129.64578247070312, 126.86514282226562, 130.36273193359375, 131.0977783203125, 130.60321044921875, 130.40802001953125, 128.91793823242188, 128.58258056640625, 130.81521606445312, 131.12432861328125, 131.3905792236328, 131.080810546875, 129.88929748535156, 131.58497619628906, 130.02481079101562], "compile_time": 1054.1019989177585, "verification_time": 0, "benchmark_time": 4161.115629598498, "GFLOP/s": 58.085338830171594, "strategy_time": 0, "framework_time": 2.1836059167981148, "timestamp": "2023-05-18 08:29:42.077727+00:00"},
"16,1,3,2,0,0": {"block_size_x": 16, "block_size_y": 1, "tile_size_x": 3, "tile_size_y": 2, "read_only": 0, "use_padding": 0, "time": 109.37504959106445, "times": [110.08228302001953, 109.32756042480469, 109.33251953125, 109.31172180175781, 109.39811706542969, 109.40164184570312, 109.35395812988281, 109.3313980102539, 109.37812042236328, 109.3149185180664, 109.34195709228516, 109.32723999023438, 109.3715591430664, 109.4021224975586, 109.3454818725586, 109.34771728515625, 109.31939697265625, 109.34931945800781, 109.35572052001953, 109.31907653808594, 109.3313980102539, 109.33683776855469, 109.33444213867188, 109.41956329345703, 109.31331634521484, 109.40003967285156, 109.31571960449219, 109.38404083251953, 109.36708068847656, 109.39875793457031, 109.35812377929688, 109.33043670654297], "compile_time": 2044.1311048343778, "verification_time": 0, "benchmark_time": 3501.846476458013, "GFLOP/s": 69.02622881751623, "strategy_time": 0, "framework_time": 1.6201017424464226, "timestamp": "2023-05-18 08:29:47.625349+00:00"},
"16,1,3,2,0,1": {"block_size_x": 16, "block_size_y": 1, "tile_size_x": 3, "tile_size_y": 2, "read_only": 0, "use_padding": 1, "time": 140.13192892074585, "times": [140.82127380371094, 140.0823974609375, 140.0968017578125, 140.1719970703125, 140.14495849609375, 140.00143432617188, 140.12191772460938, 140.21168518066406, 140.11024475097656, 140.01951599121094, 140.0892791748047, 140.1551971435547, 140.09056091308594, 140.12911987304688, 140.10208129882812, 140.17552185058594, 140.1814422607422, 140.09552001953125, 140.12783813476562, 140.03855895996094, 140.14559936523438, 140.11375427246094, 140.01263427734375, 140.103515625, 140.0966339111328, 140.03631591796875, 140.13999938964844, 140.12911987304688, 140.11216735839844, 140.09007263183594, 140.17872619628906, 140.09584045410156], "compile_time": 2209.058402106166, "verification_time": 0, "benchmark_time": 4486.187079921365, "GFLOP/s": 53.87599570023685, "strategy_time": 0, "framework_time": 1.5434762462973595, "timestamp": "2023-05-18 08:29:54.322164+00:00"},
"16,1,3,2,1,0": {"block_size_x": 16, "block_size_y": 1, "tile_size_x": 3, "tile_size_y": 2, "read_only": 1, "use_padding": 0, "time": 110.31141519546509, "times": [111.04308319091797, 110.280517578125, 110.21219635009766, 110.32099914550781, 110.34147644042969, 110.33908081054688, 110.23860168457031, 110.17748260498047, 110.31220245361328, 110.27908325195312, 110.30403900146484, 110.2984390258789, 110.26692199707031, 110.3310775756836, 110.34339904785156, 110.3232421875, 110.26915740966797, 110.22451782226562, 110.27172088623047, 110.29075622558594, 110.32868194580078, 110.24579620361328, 110.30516052246094, 110.33380126953125, 110.34707641601562, 110.2723617553711, 110.23428344726562, 110.26628112792969, 110.27716064453125, 110.31828308105469, 110.2677230834961, 110.3006820678711], "compile_time": 2021.2697423994541, "verification_time": 0, "benchmark_time": 3532.038693316281, "GFLOP/s": 68.4403077108775, "strategy_time": 0, "framework_time": 1.5622153878211975, "timestamp": "2023-05-18 08:29:59.877066+00:00"},
"16,1,3,2,1,1": {"block_size_x": 16, "block_size_y": 1, "tile_size_x": 3, "tile_size_y": 2, "read_only": 1, "use_padding": 1, "time": 140.0259552001953, "times": [140.82608032226562, 139.9574432373047, 139.9694366455078, 139.87808227539062, 140.0447998046875, 139.97935485839844, 140.06687927246094, 140.10064697265625, 140.04640197753906, 140.07408142089844, 139.9622344970703, 139.87808227539062, 139.9641571044922, 139.94239807128906, 139.90911865234375, 139.99168395996094, 140.02960205078125, 139.97247314453125, 140.0595245361328, 139.9835205078125, 139.94479370117188, 139.99087524414062, 140.0063934326172, 140.05552673339844, 140.0496063232422, 139.9720001220703, 140.05360412597656, 140.06959533691406, 140.03024291992188, 140.07696533203125, 140.01904296875, 139.92591857910156], "compile_time": 1946.7121232300997, "verification_time": 0, "benchmark_time": 4482.887944206595, "GFLOP/s": 53.916769853175545, "strategy_time": 0, "framework_time": 1.9089989364147186, "timestamp": "2023-05-18 08:30:06.308619+00:00"},
"16,1,3,3,0,0": {"block_size_x": 16, "block_size_y": 1, "tile_size_x": 3, "tile_size_y": 3, "read_only": 0, "use_padding": 0, "time": 19.533892929553986, "times": [20.790855407714844, 19.50813865661621, 19.491178512573242, 19.509258270263672, 19.50493812561035, 19.493738174438477, 19.484458923339844, 19.48973846435547, 19.482057571411133, 19.48221778869629, 19.491178512573242, 19.491498947143555, 19.48877716064453, 19.50221824645996, 19.504457473754883, 19.487817764282227, 19.48765754699707, 19.4959774017334, 19.487018585205078, 19.507017135620117, 19.485578536987305, 19.5057373046875, 19.494218826293945, 19.49309730529785, 19.498857498168945, 19.487018585205078, 19.502857208251953, 19.4913387298584, 19.49197769165039, 19.488937377929688, 19.482858657836914, 19.481897354125977], "compile_time": 1162.9087449982762, "verification_time": 0, "benchmark_time": 627.2259252145886, "GFLOP/s": 386.4947569451217, "strategy_time": 0, "framework_time": 1.861809752881527, "timestamp": "2023-05-18 08:30:08.100643+00:00"},
"16,1,3,3,0,1": {"block_size_x": 16, "block_size_y": 1, "tile_size_x": 3, "tile_size_y": 3, "read_only": 0, "use_padding": 1, "time": 22.748355329036713, "times": [24.092132568359375, 22.709253311157227, 22.700136184692383, 22.6993350982666, 22.70173454284668, 22.707975387573242, 22.69005584716797, 22.70557403564453, 22.69085693359375, 22.710376739501953, 22.688453674316406, 22.714696884155273, 22.72429656982422, 22.721256256103516, 22.723495483398438, 22.69981575012207, 22.71117401123047, 22.70029640197754, 22.68845558166504, 22.722854614257812, 22.700775146484375, 22.70621681213379, 22.725894927978516, 22.720455169677734, 22.69037628173828, 22.688453674316406, 22.707015991210938, 22.6946964263916, 22.706693649291992, 22.70893669128418, 22.692455291748047, 22.703174591064453], "compile_time": 1147.0785029232502, "verification_time": 0, "benchmark_time": 729.7295182943344, "GFLOP/s": 331.88101253031095, "strategy_time": 0, "framework_time": 1.3999762013554573, "timestamp": "2023-05-18 08:30:09.978876+00:00"},
"16,1,3,3,1,0": {"block_size_x": 16, "block_size_y": 1, "tile_size_x": 3, "tile_size_y": 3, "read_only": 1, "use_padding": 0, "time": 19.520347595214844, "times": [20.44237518310547, 19.488298416137695, 19.482858657836914, 19.5057373046875, 19.50541877746582, 19.503498077392578, 19.48877716064453, 19.470378875732422, 19.4892578125, 19.487337112426758, 19.49277687072754, 19.49197769165039, 19.48877716064453, 19.50381851196289, 19.489416122436523, 19.48653793334961, 19.503658294677734, 19.487497329711914, 19.47613525390625, 19.482057571411133, 19.489898681640625, 19.482858657836914, 19.4959774017334, 19.49309730529785, 19.47901725769043, 19.493417739868164, 19.493736267089844, 19.48301887512207, 19.503337860107422, 19.489578247070312, 19.488296508789062, 19.492298126220703], "compile_time": 1118.2788647711277, "verification_time": 0, "benchmark_time": 626.7639612779021, "GFLOP/s": 386.76294892672513, "strategy_time": 0, "framework_time": 1.392042264342308, "timestamp": "2023-05-18 08:30:11.725336+00:00"},
"16,1,3,3,1,1": {"block_size_x": 16, "block_size_y": 1, "tile_size_x": 3, "tile_size_y": 3, "read_only": 1, "use_padding": 1, "time": 22.851734042167664, "times": [23.8430118560791, 22.83613395690918, 22.80157470703125, 22.833253860473633, 22.832294464111328, 22.81293487548828, 22.807973861694336, 22.83501434326172, 22.829574584960938, 22.805253982543945, 22.8188533782959, 22.831653594970703, 22.79757308959961, 22.797414779663086, 22.814054489135742, 22.810213088989258, 22.831174850463867, 22.831974029541016, 22.814374923706055, 22.815654754638672, 22.833574295043945, 22.80157470703125, 22.812454223632812, 22.8054141998291, 22.815654754638672, 22.810693740844727, 22.834373474121094, 22.814533233642578, 22.830533981323242, 22.830373764038086, 22.83453369140625, 22.83181381225586], "compile_time": 1100.6345236673951, "verification_time": 0, "benchmark_time": 732.9199891537428, "GFLOP/s": 330.37961959773656, "strategy_time": 0, "framework_time": 1.4957264065742493, "timestamp": "2023-05-18 08:30:13.560412+00:00"},
"16,1,3,4,0,0": {"block_size_x": 16, "block_size_y": 1, "tile_size_x": 3, "tile_size_y": 4, "read_only": 0, "use_padding": 0, "time": 34.952154994010925, "times": [35.88251495361328, 34.90251922607422, 34.913238525390625, 34.91836166381836, 34.934200286865234, 34.93899917602539, 34.962039947509766, 34.917720794677734, 34.925079345703125, 34.923641204833984, 34.92300033569336, 34.91019821166992, 34.926361083984375, 34.92811965942383, 34.89899826049805, 34.911800384521484, 34.922359466552734, 34.91244125366211, 34.903961181640625, 34.915321350097656, 34.89691925048828, 34.9286003112793, 34.94219970703125, 34.911319732666016, 34.923160552978516, 34.93851852416992, 34.895320892333984, 34.93244171142578, 34.94252014160156, 34.93132019042969, 34.92348098754883, 34.932281494140625], "compile_time": 1489.2298895865679, "verification_time": 0, "benchmark_time": 1120.4592967405915, "GFLOP/s": 216.00233809027378, "strategy_time": 0, "framework_time": 1.635081134736538, "timestamp": "2023-05-18 08:30:16.171757+00:00"},
"16,1,3,4,0,1": {"block_size_x": 16, "block_size_y": 1, "tile_size_x": 3, "tile_size_y": 4, "read_only": 0, "use_padding": 1, "time": 39.925952315330505, "times": [41.00187301635742, 39.91739273071289, 39.881072998046875, 39.870033264160156, 39.91787338256836, 39.86475372314453, 39.85579299926758, 39.849552154541016, 39.88811111450195, 39.886993408203125, 39.924591064453125, 39.89275360107422, 39.90827178955078, 39.88235092163086, 39.88715362548828, 39.89259338378906, 39.89659118652344, 39.87019348144531, 39.913230895996094, 39.919151306152344, 39.88683319091797, 39.89643096923828, 39.903953552246094, 39.86219024658203, 39.87995147705078, 39.91979217529297, 39.884910583496094, 39.89851379394531, 39.936912536621094, 39.884910583496094, 39.89419174194336, 39.86155319213867], "compile_time": 1472.9242473840714, "verification_time": 0, "benchmark_time": 1279.7057060524821, "GFLOP/s": 189.09372882011627, "strategy_time": 0, "framework_time": 1.305968500673771, "timestamp": "2023-05-18 08:30:18.925718+00:00"},
"16,1,3,4,1,0": {"block_size_x": 16, "block_size_y": 1, "tile_size_x": 3, "tile_size_y": 4, "read_only": 1, "use_padding": 0, "time": 35.19366979598999, "times": [35.78107452392578, 35.166839599609375, 35.18347930908203, 35.16891860961914, 35.18172073364258, 35.16156005859375, 35.18172073364258, 35.18796157836914, 35.16939926147461, 35.172279357910156, 35.180118560791016, 35.16844177246094, 35.16619873046875, 35.186519622802734, 35.17068099975586, 35.149078369140625, 35.16204071044922, 35.20172119140625, 35.173240661621094, 35.16379928588867, 35.157718658447266, 35.17116165161133, 35.174678802490234, 35.18988037109375, 35.16075897216797, 35.19580078125, 35.184600830078125, 35.182838439941406, 35.16796112060547, 35.1793212890625, 35.19211959838867, 35.16379928588867], "compile_time": 1488.4458361193538, "verification_time": 0, "benchmark_time": 1127.9980968683958, "GFLOP/s": 214.5200328287511, "strategy_time": 0, "framework_time": 1.3500126078724861, "timestamp": "2023-05-18 08:30:21.543533+00:00"},
"16,1,3,4,1,1": {"block_size_x": 16, "block_size_y": 1, "tile_size_x": 3, "tile_size_y": 4, "read_only": 1, "use_padding": 1, "time": 40.295811891555786, "times": [41.025390625, 40.243953704833984, 40.28731155395508, 40.27259063720703, 40.27163314819336, 40.31547164916992, 40.30651092529297, 40.25691223144531, 40.26603317260742, 40.28907012939453, 40.20619201660156, 40.2477912902832, 40.281070709228516, 40.275630950927734, 40.32187271118164, 40.262351989746094, 40.283470153808594, 40.2117919921875, 40.2807502746582, 40.292110443115234, 40.2967529296875, 40.25147247314453, 40.274192810058594, 40.262351989746094, 40.28859329223633, 40.26715087890625, 40.2772331237793, 40.269073486328125, 40.2700309753418, 40.25739288330078, 40.27739334106445, 40.276432037353516], "compile_time": 1467.8798532113433, "verification_time": 0, "benchmark_time": 1291.4015147835016, "GFLOP/s": 187.35811106915781, "strategy_time": 0, "framework_time": 1.2540780007839203, "timestamp": "2023-05-18 08:30:24.304089+00:00"},
"16,1,4,1,0,0": {"block_size_x": 16, "block_size_y": 1, "tile_size_x": 4, "tile_size_y": 1, "read_only": 0, "use_padding": 0, "time": 13.245059579610825, "times": [14.267182350158691, 13.217743873596191, 13.219024658203125, 13.210704803466797, 13.215985298156738, 13.215664863586426, 13.217904090881348, 13.203185081481934, 13.218864440917969, 13.215825080871582, 13.216944694519043, 13.202544212341309, 13.219505310058594, 13.20958423614502, 13.206225395202637, 13.202545166015625, 13.217264175415039, 13.208624839782715, 13.209903717041016, 13.210704803466797, 13.211185455322266, 13.206864356994629, 13.21214485168457, 13.207023620605469, 13.220785140991211, 13.213424682617188, 13.218064308166504, 13.217905044555664, 13.212464332580566, 13.199344635009766, 13.209745407104492, 13.207023620605469], "compile_time": 1027.7943201363087, "verification_time": 0, "benchmark_time": 425.8109899237752, "GFLOP/s": 570.0047745819073, "strategy_time": 0, "framework_time": 1.4458941295742989, "timestamp": "2023-05-18 08:30:25.759174+00:00"},
"16,1,4,1,0,1": {"block_size_x": 16, "block_size_y": 1, "tile_size_x": 4, "tile_size_y": 1, "read_only": 0, "use_padding": 1, "time": 13.241879642009735, "times": [14.251181602478027, 13.223983764648438, 13.202544212341309, 13.203185081481934, 13.216625213623047, 13.211344718933105, 13.218864440917969, 13.21054458618164, 13.217905044555664, 13.202065467834473, 13.202384948730469, 13.208784103393555, 13.207984924316406, 13.20942497253418, 13.202384948730469, 13.2103853225708, 13.199983596801758, 13.209424018859863, 13.202545166015625, 13.209904670715332, 13.209104537963867, 13.199664115905762, 13.211825370788574, 13.209904670715332, 13.208945274353027, 13.219345092773438, 13.20958423614502, 13.209745407104492, 13.202705383300781, 13.211825370788574, 13.208464622497559, 13.217583656311035], "compile_time": 1025.693449191749, "verification_time": 0, "benchmark_time": 425.61662290245295, "GFLOP/s": 570.1416569327891, "strategy_time": 0, "framework_time": 1.5776930376887321, "timestamp": "2023-05-18 08:30:27.212088+00:00"},
"16,1,4,1,1,0": {"block_size_x": 16, "block_size_y": 1, "tile_size_x": 4, "tile_size_y": 1, "read_only": 1, "use_padding": 0, "time": 12.236825585365295, "times": [13.236783027648926, 12.206384658813477, 12.203986167907715, 12.211504936218262, 12.21086597442627, 12.205426216125488, 12.20926570892334, 12.207984924316406, 12.20926570892334, 12.206384658813477, 12.200785636901855, 12.192625999450684, 12.202546119689941, 12.20318603515625, 12.192146301269531, 12.202865600585938, 12.203825950622559, 12.206866264343262, 12.20318603515625, 12.210704803466797, 12.202225685119629, 12.192304611206055, 12.211186408996582, 12.194705963134766, 12.2091064453125, 12.204145431518555, 12.20158576965332, 12.209904670715332, 12.2124662399292, 12.206866264343262, 12.203665733337402, 12.203664779663086], "compile_time": 1029.98239826411, "verification_time": 0, "benchmark_time": 393.6490071937442, "GFLOP/s": 616.9694213039339, "strategy_time": 0, "framework_time": 1.3660816475749016, "timestamp": "2023-05-18 08:30:28.637110+00:00"},
"16,1,4,1,1,1": {"block_size_x": 16, "block_size_y": 1, "tile_size_x": 4, "tile_size_y": 1, "read_only": 1, "use_padding": 1, "time": 12.239305436611176, "times": [13.315342903137207, 12.216785430908203, 12.197905540466309, 12.204304695129395, 12.20766544342041, 12.209905624389648, 12.196146011352539, 12.208785057067871, 12.199666023254395, 12.202705383300781, 12.207185745239258, 12.204465866088867, 12.205105781555176, 12.20334529876709, 12.20318603515625, 12.192464828491211, 12.194705963134766, 12.21198558807373, 12.210065841674805, 12.204625129699707, 12.209586143493652, 12.207984924316406, 12.201584815979004, 12.207345962524414, 12.209746360778809, 12.196624755859375, 12.204626083374023, 12.204785346984863, 12.20350456237793, 12.211026191711426, 12.201425552368164, 12.203185081481934], "compile_time": 1029.2236721143126, "verification_time": 0, "benchmark_time": 393.89429055154324, "GFLOP/s": 616.844414832283, "strategy_time": 0, "framework_time": 1.462666317820549, "timestamp": "2023-05-18 08:30:30.061713+00:00"},
"16,1,4,2,0,0": {"block_size_x": 16, "block_size_y": 1, "tile_size_x": 4, "tile_size_y": 2, "read_only": 0, "use_padding": 0, "time": 9.723013460636139, "times": [10.668625831604004, 9.68974781036377, 9.69710922241211, 9.692788124084473, 9.689107894897461, 9.6964693069458, 9.691349029541016, 9.688789367675781, 9.691027641296387, 9.690709114074707, 9.696468353271484, 9.691667556762695, 9.692309379577637, 9.693589210510254, 9.692628860473633, 9.694707870483398, 9.699508666992188, 9.688467979431152, 9.694388389587402, 9.697269439697266, 9.687989234924316, 9.691349029541016, 9.688947677612305, 9.691509246826172, 9.69070816040039, 9.697587966918945, 9.691828727722168, 9.69118881225586, 9.693268775939941, 9.689587593078613, 9.69822883605957, 9.687507629394531], "compile_time": 1602.5490751489997, "verification_time": 0, "benchmark_time": 313.18389158695936, "GFLOP/s": 776.4822326499226, "strategy_time": 0, "framework_time": 1.511627808213234, "timestamp": "2023-05-18 08:30:31.978981+00:00"},
"16,1,4,2,0,1": {"block_size_x": 16, "block_size_y": 1, "tile_size_x": 4, "tile_size_y": 2, "read_only": 0, "use_padding": 1, "time": 9.725008338689804, "times": [10.707345962524414, 9.689268112182617, 9.69518756866455, 9.695348739624023, 9.691827774047852, 9.692148208618164, 9.698708534240723, 9.69390869140625, 9.689587593078613, 9.694388389587402, 9.693108558654785, 9.699828147888184, 9.695508003234863, 9.691828727722168, 9.689908981323242, 9.692627906799316, 9.694868087768555, 9.690709114074707, 9.692948341369629, 9.694868087768555, 9.694708824157715, 9.684788703918457, 9.697908401489258, 9.697587966918945, 9.69374942779541, 9.695508003234863, 9.689908027648926, 9.694389343261719, 9.695189476013184, 9.692788124084473, 9.689587593078613, 9.690229415893555], "compile_time": 1600.23236554116, "verification_time": 0, "benchmark_time": 313.24302311986685, "GFLOP/s": 776.322953880072, "strategy_time": 0, "framework_time": 1.345144584774971, "timestamp": "2023-05-18 08:30:33.893824+00:00"},
"16,1,4,2,1,0": {"block_size_x": 16, "block_size_y": 1, "tile_size_x": 4, "tile_size_y": 2, "read_only": 1, "use_padding": 0, "time": 9.306773781776428, "times": [10.26590633392334, 9.278868675231934, 9.281108856201172, 9.277749061584473, 9.273589134216309, 9.27902889251709, 9.275029182434082, 9.278709411621094, 9.280308723449707, 9.277749061584473, 9.271988868713379, 9.269268035888672, 9.278549194335938, 9.281108856201172, 9.275508880615234, 9.272468566894531, 9.275829315185547, 9.275508880615234, 9.276947975158691, 9.271669387817383, 9.274868965148926, 9.266868591308594, 9.279668807983398, 9.275348663330078, 9.275348663330078, 9.28078842163086, 9.271188735961914, 9.273589134216309, 9.270548820495605, 9.27902889251709, 9.281908988952637, 9.270709037780762], "compile_time": 1602.346402592957, "verification_time": 0, "benchmark_time": 299.5926709845662, "GFLOP/s": 811.2099183911768, "strategy_time": 0, "framework_time": 1.5437901020050049, "timestamp": "2023-05-18 08:30:35.797329+00:00"},
"16,1,4,2,1,1": {"block_size_x": 16, "block_size_y": 1, "tile_size_x": 4, "tile_size_y": 2, "read_only": 1, "use_padding": 1, "time": 9.30701869726181, "times": [10.254865646362305, 9.281429290771484, 9.278388977050781, 9.279027938842773, 9.276148796081543, 9.275348663330078, 9.277588844299316, 9.27022933959961, 9.279189109802246, 9.273428916931152, 9.280308723449707, 9.277748107910156, 9.273268699645996, 9.280149459838867, 9.272628784179688, 9.280308723449707, 9.280789375305176, 9.271027565002441, 9.276469230651855, 9.279508590698242, 9.2763090133667, 9.278228759765625, 9.275029182434082, 9.272468566894531, 9.274388313293457, 9.27726936340332, 9.279989242553711, 9.275029182434082, 9.27470874786377, 9.272628784179688, 9.279668807983398, 9.271027565002441], "compile_time": 1608.9594420045614, "verification_time": 0, "benchmark_time": 299.5132515206933, "GFLOP/s": 811.1885712898791, "strategy_time": 0, "framework_time": 1.4332300052046776, "timestamp": "2023-05-18 08:30:37.707255+00:00"},
"16,1,4,3,0,0": {"block_size_x": 16, "block_size_y": 1, "tile_size_x": 4, "tile_size_y": 3, "read_only": 0, "use_padding": 0, "time": 31.94477689266205, "times": [32.740440368652344, 31.917081832885742, 31.930362701416016, 31.934202194213867, 31.93084144592285, 31.925241470336914, 31.899961471557617, 31.906362533569336, 31.92220115661621, 31.918521881103516, 31.902841567993164, 31.920122146606445, 31.924762725830078, 31.91004180908203, 31.907642364501953, 31.92540168762207, 31.897722244262695, 31.925722122192383, 31.929882049560547, 31.89276123046875, 31.89276123046875, 31.955322265625, 31.92156219482422, 31.941402435302734, 31.92428207397461, 31.951801300048828, 31.908601760864258, 31.896121978759766, 31.920602798461914, 31.911962509155273, 31.92380142211914, 31.922521591186523], "compile_time": 1448.077943176031, "verification_time": 0, "benchmark_time": 1024.5092026889324, "GFLOP/s": 236.33745276631535, "strategy_time": 0, "framework_time": 1.4220979064702988, "timestamp": "2023-05-18 08:30:40.181291+00:00"},
"16,1,4,3,0,1": {"block_size_x": 16, "block_size_y": 1, "tile_size_x": 4, "tile_size_y": 3, "read_only": 0, "use_padding": 1, "time": 31.94388633966446, "times": [32.79051971435547, 31.929882049560547, 31.893882751464844, 31.90300178527832, 31.89708137512207, 31.901721954345703, 31.900922775268555, 31.932600021362305, 31.928762435913086, 31.90443992614746, 31.918039321899414, 31.896442413330078, 31.912282943725586, 31.905881881713867, 31.92108154296875, 31.928600311279297, 31.920761108398438, 31.920921325683594, 31.885881423950195, 31.93115997314453, 31.916601181030273, 31.934040069580078, 31.916921615600586, 31.923160552978516, 31.931482315063477, 31.92523956298828, 31.933242797851562, 31.921720504760742, 31.92588233947754, 31.900922775268555, 31.929561614990234, 31.921720504760742], "compile_time": 1491.0213947296143, "verification_time": 0, "benchmark_time": 1024.3172589689493, "GFLOP/s": 236.34404153966514, "strategy_time": 0, "framework_time": 1.77092757076025, "timestamp": "2023-05-18 08:30:42.698431+00:00"},
"16,1,4,3,1,0": {"block_size_x": 16, "block_size_y": 1, "tile_size_x": 4, "tile_size_y": 3, "read_only": 1, "use_padding": 0, "time": 32.12781012058258, "times": [32.9857177734375, 32.098838806152344, 32.09788131713867, 32.07564163208008, 32.0897216796875, 32.102840423583984, 32.117881774902344, 32.0901985168457, 32.107479095458984, 32.08811950683594, 32.1092414855957, 32.11436080932617, 32.110679626464844, 32.084598541259766, 32.10940170288086, 32.11083984375, 32.10795974731445, 32.089080810546875, 32.116920471191406, 32.089561462402344, 32.089561462402344, 32.0901985168457, 32.100440979003906, 32.10715866088867, 32.102359771728516, 32.1020393371582, 32.090999603271484, 32.11371994018555, 32.10588073730469, 32.08108139038086, 32.115318298339844, 32.094200134277344], "compile_time": 1454.2649276554585, "verification_time": 0, "benchmark_time": 1030.147789977491, "GFLOP/s": 234.99103025273666, "strategy_time": 0, "framework_time": 1.3855593279004097, "timestamp": "2023-05-18 08:30:45.184253+00:00"},
"16,1,4,3,1,1": {"block_size_x": 16, "block_size_y": 1, "tile_size_x": 4, "tile_size_y": 3, "read_only": 1, "use_padding": 1, "time": 32.131075501441956, "times": [32.980918884277344, 32.10251998901367, 32.08412170410156, 32.089881896972656, 32.13003921508789, 32.10940170288086, 32.10652160644531, 32.1092414855957, 32.08795928955078, 32.11627960205078, 32.095001220703125, 32.112281799316406, 32.11996078491211, 32.08380126953125, 32.11116027832031, 32.096920013427734, 32.089561462402344, 32.09579849243164, 32.10892105102539, 32.117401123046875, 32.079959869384766, 32.08620071411133, 32.105560302734375, 32.114681243896484, 32.082679748535156, 32.111480712890625, 32.11404037475586, 32.09980010986328, 32.11676025390625, 32.102840423583984, 32.10844039916992, 32.1242790222168], "compile_time": 1494.782194495201, "verification_time": 0, "benchmark_time": 1030.0996685400605, "GFLOP/s": 234.967148848198, "strategy_time": 0, "framework_time": 1.383916474878788, "timestamp": "2023-05-18 08:30:47.710544+00:00"},
"16,1,4,4,0,0": {"block_size_x": 16, "block_size_y": 1, "tile_size_x": 4, "tile_size_y": 4, "read_only": 0, "use_padding": 0, "time": 48.28171503543854, "times": [49.24601745605469, 48.27914047241211, 48.28826141357422, 48.24618148803711, 48.25001907348633, 48.233219146728516, 48.2504997253418, 48.242820739746094, 48.23529815673828, 48.23577880859375, 48.25482177734375, 48.2401008605957, 48.262020111083984, 48.25994110107422, 48.22874069213867, 48.258819580078125, 48.219940185546875, 48.25321960449219, 48.25001907348633, 48.233699798583984, 48.25482177734375, 48.22954177856445, 48.27162170410156, 48.22441864013672, 48.24729919433594, 48.23017883300781, 48.26105880737305, 48.26026153564453, 48.27513885498047, 48.248260498046875, 48.26441955566406, 48.279300689697266], "compile_time": 1727.5443021208048, "verification_time": 0, "benchmark_time": 1547.1219262108207, "GFLOP/s": 156.3686624316995, "strategy_time": 0, "framework_time": 1.4146044850349426, "timestamp": "2023-05-18 08:30:50.986656+00:00"},
"16,1,4,4,0,1": {"block_size_x": 16, "block_size_y": 1, "tile_size_x": 4, "tile_size_y": 4, "read_only": 0, "use_padding": 1, "time": 48.27808451652527, "times": [48.96265411376953, 48.24409866333008, 48.24522018432617, 48.27289962768555, 48.270179748535156, 48.282981872558594, 48.278499603271484, 48.27785873413086, 48.222660064697266, 48.263938903808594, 48.2298583984375, 48.244258880615234, 48.28153991699219, 48.26826095581055, 48.22842025756836, 48.23674011230469, 48.22233963012695, 48.26681900024414, 48.27177810668945, 48.264739990234375, 48.23802185058594, 48.25994110107422, 48.25001907348633, 48.28554153442383, 48.25225830078125, 48.241058349609375, 48.219940185546875, 48.28746032714844, 48.26089859008789, 48.23881912231445, 48.26057815551758, 48.2684211730957], "compile_time": 1721.0736209526658, "verification_time": 0, "benchmark_time": 1546.7915022745728, "GFLOP/s": 156.38042137764955, "strategy_time": 0, "framework_time": 1.5947250649333, "timestamp": "2023-05-18 08:30:54.256140+00:00"},
